No.     Time           Source                Destination           Protocol Length Info
     19 30.046956754   192.168.0.18          192.168.0.3           TCP      74     44934 → 1234 [SYN] Seq=0 Win=29200 Len=0 MSS=1460 SACK_PERM=1 TSval=3166296812 TSecr=0 WS=128
     20 30.048678619   192.168.0.3           192.168.0.18          TCP      74     1234 → 44934 [SYN, ACK] Seq=0 Ack=1 Win=28960 Len=0 MSS=1460 SACK_PERM=1 TSval=505659456 TSecr=3166296812 WS=128
     21 30.148752252   192.168.0.18          192.168.0.3           TCP      66     44934 → 1234 [ACK] Seq=1 Ack=1 Win=29312 Len=0 TSval=3166296838 TSecr=505659456
     22 30.148887989   192.168.0.18          192.168.0.3           TCP      1066   44934 → 1234 [PSH, ACK] Seq=1 Ack=1 Win=29312 Len=1000 TSval=3166296838 TSecr=505659456
     23 30.148919726   192.168.0.18          192.168.0.3           TCP      1514   44934 → 1234 [ACK] Seq=1001 Ack=1 Win=29312 Len=1448 TSval=3166296838 TSecr=505659456
     24 30.148924301   192.168.0.18          192.168.0.3           TCP      1514   44934 → 1234 [ACK] Seq=2449 Ack=1 Win=29312 Len=1448 TSval=3166296838 TSecr=505659456
     25 30.148925786   192.168.0.18          192.168.0.3           TCP      1514   44934 → 1234 [ACK] Seq=3897 Ack=1 Win=29312 Len=1448 TSval=3166296838 TSecr=505659456
     26 30.148928683   192.168.0.18          192.168.0.3           TCP      1514   44934 → 1234 [ACK] Seq=5345 Ack=1 Win=29312 Len=1448 TSval=3166296838 TSecr=505659456
     27 30.148932273   192.168.0.18          192.168.0.3           TCP      1514   44934 → 1234 [ACK] Seq=6793 Ack=1 Win=29312 Len=1448 TSval=3166296838 TSecr=505659456
     28 30.148934239   192.168.0.18          192.168.0.3           TCP      1514   44934 → 1234 [ACK] Seq=8241 Ack=1 Win=29312 Len=1448 TSval=3166296838 TSecr=505659456
     29 30.149199193   192.168.0.18          192.168.0.3           TCP      1514   44934 → 1234 [ACK] Seq=9689 Ack=1 Win=29312 Len=1448 TSval=3166296838 TSecr=505659456
     30 30.149206081   192.168.0.18          192.168.0.3           TCP      1514   44934 → 1234 [ACK] Seq=11137 Ack=1 Win=29312 Len=1448 TSval=3166296838 TSecr=505659456
     31 30.149207639   192.168.0.18          192.168.0.3           TCP      1514   44934 → 1234 [ACK] Seq=12585 Ack=1 Win=29312 Len=1448 TSval=3166296838 TSecr=505659456
     32 30.150316241   192.168.0.3           192.168.0.18          TCP      66     1234 → 44934 [ACK] Seq=1 Ack=1001 Win=32128 Len=0 TSval=505659510 TSecr=3166296838
     33 30.150362240   192.168.0.3           192.168.0.18          TCP      66     1234 → 44934 [ACK] Seq=1 Ack=3897 Win=37888 Len=0 TSval=505659510 TSecr=3166296838
     34 30.150976359   192.168.0.3           192.168.0.18          TCP      66     1234 → 44934 [ACK] Seq=1 Ack=5345 Win=40832 Len=0 TSval=505659510 TSecr=3166296838
     35 30.151008843   192.168.0.3           192.168.0.18          TCP      66     1234 → 44934 [ACK] Seq=1 Ack=6793 Win=43776 Len=0 TSval=505659510 TSecr=3166296838
     36 30.151020727   192.168.0.3           192.168.0.18          TCP      66     1234 → 44934 [ACK] Seq=1 Ack=8241 Win=46592 Len=0 TSval=505659510 TSecr=3166296838
     37 30.152171477   192.168.0.3           192.168.0.18          TCP      66     1234 → 44934 [ACK] Seq=1 Ack=9689 Win=49536 Len=0 TSval=505659511 TSecr=3166296838
     38 30.152203328   192.168.0.3           192.168.0.18          TCP      66     1234 → 44934 [ACK] Seq=1 Ack=11137 Win=52480 Len=0 TSval=505659511 TSecr=3166296838
     39 30.152216763   192.168.0.3           192.168.0.18          TCP      66     1234 → 44934 [ACK] Seq=1 Ack=12585 Win=55296 Len=0 TSval=505659511 TSecr=3166296838
     40 30.152227766   192.168.0.3           192.168.0.18          TCP      66     1234 → 44934 [ACK] Seq=1 Ack=14033 Win=58240 Len=0 TSval=505659511 TSecr=3166296838
     41 30.250370153   192.168.0.18          192.168.0.3           TCP      1514   44934 → 1234 [ACK] Seq=14033 Ack=1 Win=29312 Len=1448 TSval=3166296863 TSecr=505659510
     42 30.250378233   192.168.0.18          192.168.0.3           TCP      1514   44934 → 1234 [ACK] Seq=15481 Ack=1 Win=29312 Len=1448 TSval=3166296863 TSecr=505659510
     43 30.250386022   192.168.0.18          192.168.0.3           TCP      1514   44934 → 1234 [ACK] Seq=16929 Ack=1 Win=29312 Len=1448 TSval=3166296863 TSecr=505659510
     44 30.250387617   192.168.0.18          192.168.0.3           TCP      1514   44934 → 1234 [ACK] Seq=18377 Ack=1 Win=29312 Len=1448 TSval=3166296863 TSecr=505659510
     45 30.250388851   192.168.0.18          192.168.0.3           TCP      1514   44934 → 1234 [ACK] Seq=19825 Ack=1 Win=29312 Len=1448 TSval=3166296863 TSecr=505659510
     46 30.250390100   192.168.0.18          192.168.0.3           TCP      1514   44934 → 1234 [ACK] Seq=21273 Ack=1 Win=29312 Len=1448 TSval=3166296863 TSecr=505659510
     47 30.251014346   192.168.0.18          192.168.0.3           TCP      1514   44934 → 1234 [ACK] Seq=22721 Ack=1 Win=29312 Len=1448 TSval=3166296863 TSecr=505659510
     48 30.251022092   192.168.0.18          192.168.0.3           TCP      1514   44934 → 1234 [ACK] Seq=24169 Ack=1 Win=29312 Len=1448 TSval=3166296863 TSecr=505659510
     49 30.251026570   192.168.0.18          192.168.0.3           TCP      1514   44934 → 1234 [ACK] Seq=25617 Ack=1 Win=29312 Len=1448 TSval=3166296863 TSecr=505659510
     50 30.251028046   192.168.0.18          192.168.0.3           TCP      1514   44934 → 1234 [ACK] Seq=27065 Ack=1 Win=29312 Len=1448 TSval=3166296863 TSecr=505659510
     51 30.251033045   192.168.0.18          192.168.0.3           TCP      1514   44934 → 1234 [ACK] Seq=28513 Ack=1 Win=29312 Len=1448 TSval=3166296863 TSecr=505659510
     52 30.251034443   192.168.0.18          192.168.0.3           TCP      1514   44934 → 1234 [ACK] Seq=29961 Ack=1 Win=29312 Len=1448 TSval=3166296863 TSecr=505659510
     53 30.252229878   192.168.0.18          192.168.0.3           TCP      1514   [TCP Previous segment not captured] 44934 → 1234 [ACK] Seq=34305 Ack=1 Win=29312 Len=1448 TSval=3166296864 TSecr=505659511
     54 30.252236833   192.168.0.18          192.168.0.3           TCP      1514   44934 → 1234 [ACK] Seq=35753 Ack=1 Win=29312 Len=1448 TSval=3166296864 TSecr=505659511
     55 30.252242793   192.168.0.18          192.168.0.3           TCP      1514   44934 → 1234 [ACK] Seq=37201 Ack=1 Win=29312 Len=1448 TSval=3166296864 TSecr=505659511
     56 30.252244418   192.168.0.18          192.168.0.3           TCP      1514   44934 → 1234 [ACK] Seq=38649 Ack=1 Win=29312 Len=1448 TSval=3166296864 TSecr=505659511
     57 30.252245700   192.168.0.18          192.168.0.3           TCP      1514   44934 → 1234 [ACK] Seq=40097 Ack=1 Win=29312 Len=1448 TSval=3166296864 TSecr=505659511
     58 30.252246971   192.168.0.18          192.168.0.3           TCP      1514   44934 → 1234 [ACK] Seq=41545 Ack=1 Win=29312 Len=1448 TSval=3166296864 TSecr=505659511
     59 30.252743887   192.168.0.3           192.168.0.18          TCP      66     1234 → 44934 [ACK] Seq=1 Ack=16929 Win=64000 Len=0 TSval=505659536 TSecr=3166296863
     60 30.252778194   192.168.0.3           192.168.0.18          TCP      66     1234 → 44934 [ACK] Seq=1 Ack=19825 Win=69760 Len=0 TSval=505659536 TSecr=3166296863
     61 30.252792997   192.168.0.3           192.168.0.18          TCP      66     1234 → 44934 [ACK] Seq=1 Ack=22721 Win=75648 Len=0 TSval=505659536 TSecr=3166296863
     62 30.252804714   192.168.0.3           192.168.0.18          TCP      66     1234 → 44934 [ACK] Seq=1 Ack=24169 Win=78464 Len=0 TSval=505659536 TSecr=3166296863
     63 30.252812504   192.168.0.3           192.168.0.18          TCP      66     1234 → 44934 [ACK] Seq=1 Ack=25617 Win=81408 Len=0 TSval=505659536 TSecr=3166296863
     64 30.254180312   192.168.0.3           192.168.0.18          TCP      66     1234 → 44934 [ACK] Seq=1 Ack=27065 Win=84224 Len=0 TSval=505659536 TSecr=3166296863
     65 30.254212930   192.168.0.3           192.168.0.18          TCP      66     1234 → 44934 [ACK] Seq=1 Ack=28513 Win=87168 Len=0 TSval=505659536 TSecr=3166296863
     66 30.254225587   192.168.0.3           192.168.0.18          TCP      66     1234 → 44934 [ACK] Seq=1 Ack=31409 Win=92928 Len=0 TSval=505659536 TSecr=3166296863
     67 30.254239073   192.168.0.3           192.168.0.18          TCP      78     [TCP Window Update] 1234 → 44934 [ACK] Seq=1 Ack=31409 Win=95872 Len=0 TSval=505659536 TSecr=3166296863 SLE=34305 SRE=35753
     68 30.254251648   192.168.0.3           192.168.0.18          TCP      78     [TCP Window Update] 1234 → 44934 [ACK] Seq=1 Ack=31409 Win=98816 Len=0 TSval=505659536 TSecr=3166296863 SLE=34305 SRE=37201
     69 30.254258282   192.168.0.3           192.168.0.18          TCP      78     [TCP Window Update] 1234 → 44934 [ACK] Seq=1 Ack=31409 Win=101632 Len=0 TSval=505659536 TSecr=3166296863 SLE=34305 SRE=38649
     70 30.255358607   192.168.0.3           192.168.0.18          TCP      78     [TCP Window Update] 1234 → 44934 [ACK] Seq=1 Ack=31409 Win=104576 Len=0 TSval=505659537 TSecr=3166296863 SLE=34305 SRE=40097
     71 30.255385255   192.168.0.3           192.168.0.18          TCP      78     [TCP Window Update] 1234 → 44934 [ACK] Seq=1 Ack=31409 Win=107392 Len=0 TSval=505659537 TSecr=3166296863 SLE=34305 SRE=41545
     72 30.255404137   192.168.0.3           192.168.0.18          TCP      78     [TCP Window Update] 1234 → 44934 [ACK] Seq=1 Ack=31409 Win=110336 Len=0 TSval=505659537 TSecr=3166296863 SLE=34305 SRE=42993
     73 30.352794135   192.168.0.18          192.168.0.3           TCP      1514   44934 → 1234 [ACK] Seq=42993 Ack=1 Win=29312 Len=1448 TSval=3166296889 TSecr=505659536
     74 30.352805148   192.168.0.18          192.168.0.3           TCP      1514   44934 → 1234 [ACK] Seq=44441 Ack=1 Win=29312 Len=1448 TSval=3166296889 TSecr=505659536
     75 30.352806880   192.168.0.18          192.168.0.3           TCP      1514   44934 → 1234 [ACK] Seq=45889 Ack=1 Win=29312 Len=1448 TSval=3166296889 TSecr=505659536
     76 30.352808472   192.168.0.18          192.168.0.3           TCP      1514   44934 → 1234 [ACK] Seq=47337 Ack=1 Win=29312 Len=1448 TSval=3166296889 TSecr=505659536
     77 30.352816121   192.168.0.18          192.168.0.3           TCP      1514   44934 → 1234 [ACK] Seq=48785 Ack=1 Win=29312 Len=1448 TSval=3166296889 TSecr=505659536
     78 30.352817609   192.168.0.18          192.168.0.3           TCP      1514   44934 → 1234 [ACK] Seq=50233 Ack=1 Win=29312 Len=1448 TSval=3166296889 TSecr=505659536
     79 30.352818891   192.168.0.18          192.168.0.3           TCP      1514   44934 → 1234 [ACK] Seq=51681 Ack=1 Win=29312 Len=1448 TSval=3166296889 TSecr=505659536
     80 30.353064606   192.168.0.18          192.168.0.3           TCP      1514   44934 → 1234 [ACK] Seq=53129 Ack=1 Win=29312 Len=1448 TSval=3166296889 TSecr=505659536
     81 30.353080961   192.168.0.18          192.168.0.3           TCP      1514   44934 → 1234 [ACK] Seq=54577 Ack=1 Win=29312 Len=1448 TSval=3166296889 TSecr=505659536
     82 30.353082857   192.168.0.18          192.168.0.3           TCP      1514   44934 → 1234 [ACK] Seq=56025 Ack=1 Win=29312 Len=1448 TSval=3166296889 TSecr=505659536
     83 30.353084075   192.168.0.18          192.168.0.3           TCP      1514   44934 → 1234 [ACK] Seq=57473 Ack=1 Win=29312 Len=1448 TSval=3166296889 TSecr=505659536
     84 30.353314198   192.168.0.18          192.168.0.3           TCP      1514   44934 → 1234 [ACK] Seq=58921 Ack=1 Win=29312 Len=1448 TSval=3166296889 TSecr=505659536
     85 30.353328274   192.168.0.18          192.168.0.3           TCP      1514   44934 → 1234 [ACK] Seq=60369 Ack=1 Win=29312 Len=1448 TSval=3166296889 TSecr=505659536
     86 30.353562192   192.168.0.18          192.168.0.3           TCP      1514   44934 → 1234 [ACK] Seq=61817 Ack=1 Win=29312 Len=1448 TSval=3166296889 TSecr=505659536
     87 30.353576202   192.168.0.18          192.168.0.3           TCP      1514   44934 → 1234 [ACK] Seq=63265 Ack=1 Win=29312 Len=1448 TSval=3166296889 TSecr=505659536
     88 30.353810774   192.168.0.18          192.168.0.3           TCP      1514   44934 → 1234 [ACK] Seq=64713 Ack=1 Win=29312 Len=1448 TSval=3166296889 TSecr=505659536
     89 30.354217812   192.168.0.18          192.168.0.3           TCP      1514   44934 → 1234 [ACK] Seq=66161 Ack=1 Win=29312 Len=1448 TSval=3166296889 TSecr=505659536
     90 30.354221232   192.168.0.18          192.168.0.3           TCP      1514   44934 → 1234 [ACK] Seq=67609 Ack=1 Win=29312 Len=1448 TSval=3166296889 TSecr=505659536
     91 30.354226569   192.168.0.18          192.168.0.3           TCP      1514   44934 → 1234 [ACK] Seq=69057 Ack=1 Win=29312 Len=1448 TSval=3166296889 TSecr=505659536
     92 30.354308787   192.168.0.18          192.168.0.3           TCP      1514   44934 → 1234 [PSH, ACK] Seq=70505 Ack=1 Win=29312 Len=1448 TSval=3166296889 TSecr=505659536
     93 30.354317464   192.168.0.18          192.168.0.3           TCP      1514   [TCP Out-Of-Order] 44934 → 1234 [ACK] Seq=31409 Ack=1 Win=29312 Len=1448 TSval=3166296889 TSecr=505659536
     94 30.354793673   192.168.0.3           192.168.0.18          TCP      78     [TCP Window Update] 1234 → 44934 [ACK] Seq=1 Ack=31409 Win=116096 Len=0 TSval=505659561 TSecr=3166296863 SLE=34305 SRE=45889
     95 30.354843320   192.168.0.3           192.168.0.18          TCP      78     [TCP Window Update] 1234 → 44934 [ACK] Seq=1 Ack=31409 Win=119040 Len=0 TSval=505659562 TSecr=3166296863 SLE=34305 SRE=47337
     96 30.354855721   192.168.0.3           192.168.0.18          TCP      78     [TCP Window Update] 1234 → 44934 [ACK] Seq=1 Ack=31409 Win=121984 Len=0 TSval=505659562 TSecr=3166296863 SLE=34305 SRE=48785
     97 30.354861584   192.168.0.3           192.168.0.18          TCP      78     [TCP Window Update] 1234 → 44934 [ACK] Seq=1 Ack=31409 Win=124800 Len=0 TSval=505659562 TSecr=3166296863 SLE=34305 SRE=50233
     98 30.355405011   192.168.0.18          192.168.0.3           TCP      1514   [TCP Out-Of-Order] 44934 → 1234 [ACK] Seq=32857 Ack=1 Win=29312 Len=1448 TSval=3166296890 TSecr=505659537
     99 30.355542257   192.168.0.3           192.168.0.18          TCP      78     [TCP Window Update] 1234 → 44934 [ACK] Seq=1 Ack=31409 Win=127744 Len=0 TSval=505659562 TSecr=3166296863 SLE=34305 SRE=51681
    100 30.355567146   192.168.0.3           192.168.0.18          TCP      78     [TCP Window Update] 1234 → 44934 [ACK] Seq=1 Ack=31409 Win=130560 Len=0 TSval=505659562 TSecr=3166296863 SLE=34305 SRE=53129
    101 30.355586474   192.168.0.3           192.168.0.18          TCP      78     [TCP Window Update] 1234 → 44934 [ACK] Seq=1 Ack=31409 Win=133504 Len=0 TSval=505659562 TSecr=3166296863 SLE=34305 SRE=54577
    102 30.355595619   192.168.0.3           192.168.0.18          TCP      78     [TCP Window Update] 1234 → 44934 [ACK] Seq=1 Ack=31409 Win=136448 Len=0 TSval=505659562 TSecr=3166296863 SLE=34305 SRE=56025
    103 30.355604699   192.168.0.3           192.168.0.18          TCP      78     [TCP Window Update] 1234 → 44934 [ACK] Seq=1 Ack=31409 Win=139264 Len=0 TSval=505659562 TSecr=3166296863 SLE=34305 SRE=57473
    104 30.357203645   192.168.0.3           192.168.0.18          TCP      78     [TCP Window Update] 1234 → 44934 [ACK] Seq=1 Ack=31409 Win=147968 Len=0 TSval=505659562 TSecr=3166296863 SLE=34305 SRE=61817
    105 30.357220928   192.168.0.3           192.168.0.18          TCP      78     [TCP Window Update] 1234 → 44934 [ACK] Seq=1 Ack=31409 Win=153728 Len=0 TSval=505659562 TSecr=3166296863 SLE=34305 SRE=64713
    106 30.357234080   192.168.0.3           192.168.0.18          TCP      78     [TCP Window Update] 1234 → 44934 [ACK] Seq=1 Ack=31409 Win=156672 Len=0 TSval=505659562 TSecr=3166296863 SLE=34305 SRE=66161
    107 30.357245964   192.168.0.3           192.168.0.18          TCP      78     [TCP Window Update] 1234 → 44934 [ACK] Seq=1 Ack=31409 Win=159616 Len=0 TSval=505659562 TSecr=3166296863 SLE=34305 SRE=67609
    108 30.357257775   192.168.0.3           192.168.0.18          TCP      78     [TCP Window Update] 1234 → 44934 [ACK] Seq=1 Ack=31409 Win=162432 Len=0 TSval=505659562 TSecr=3166296863 SLE=34305 SRE=69057
    109 30.357727119   192.168.0.3           192.168.0.18          TCP      78     [TCP Window Update] 1234 → 44934 [ACK] Seq=1 Ack=31409 Win=162944 Len=0 TSval=505659562 TSecr=3166296863 SLE=34305 SRE=70505
    110 30.357743070   192.168.0.3           192.168.0.18          TCP      78     [TCP Dup ACK 66#1] 1234 → 44934 [ACK] Seq=1 Ack=31409 Win=162944 Len=0 TSval=505659562 TSecr=3166296863 SLE=34305 SRE=71953
    111 30.357755194   192.168.0.3           192.168.0.18          TCP      78     1234 → 44934 [ACK] Seq=1 Ack=32857 Win=162048 Len=0 TSval=505659562 TSecr=3166296889 SLE=34305 SRE=71953
    112 30.357767298   192.168.0.3           192.168.0.18          TCP      66     1234 → 44934 [ACK] Seq=1 Ack=71953 Win=162048 Len=0 TSval=505659562 TSecr=3166296890
    113 30.454845800   192.168.0.18          192.168.0.3           TCP      1514   44934 → 1234 [ACK] Seq=71953 Ack=1 Win=29312 Len=1448 TSval=3166296914 TSecr=505659561
    114 30.454857219   192.168.0.18          192.168.0.3           TCP      1514   44934 → 1234 [ACK] Seq=73401 Ack=1 Win=29312 Len=1448 TSval=3166296914 TSecr=505659562
    115 30.454870752   192.168.0.18          192.168.0.3           TCP      1514   44934 → 1234 [ACK] Seq=74849 Ack=1 Win=29312 Len=1448 TSval=3166296914 TSecr=505659562
    116 30.455592178   192.168.0.18          192.168.0.3           TCP      1514   44934 → 1234 [ACK] Seq=76297 Ack=1 Win=29312 Len=1448 TSval=3166296915 TSecr=505659562
    117 30.455608123   192.168.0.18          192.168.0.3           TCP      1514   44934 → 1234 [ACK] Seq=77745 Ack=1 Win=29312 Len=1448 TSval=3166296915 TSecr=505659562
    118 30.457233470   192.168.0.18          192.168.0.3           TCP      1514   44934 → 1234 [ACK] Seq=79193 Ack=1 Win=29312 Len=1448 TSval=3166296915 TSecr=505659562
    119 30.457240471   192.168.0.18          192.168.0.3           TCP      1514   44934 → 1234 [ACK] Seq=80641 Ack=1 Win=29312 Len=1448 TSval=3166296915 TSecr=505659562
    120 30.457247613   192.168.0.18          192.168.0.3           TCP      1514   44934 → 1234 [ACK] Seq=82089 Ack=1 Win=29312 Len=1448 TSval=3166296915 TSecr=505659562
    121 30.457249188   192.168.0.18          192.168.0.3           TCP      1514   44934 → 1234 [ACK] Seq=83537 Ack=1 Win=29312 Len=1448 TSval=3166296915 TSecr=505659562
    122 30.457252712   192.168.0.18          192.168.0.3           TCP      1514   44934 → 1234 [ACK] Seq=84985 Ack=1 Win=29312 Len=1448 TSval=3166296915 TSecr=505659562
    123 30.457260628   192.168.0.18          192.168.0.3           TCP      1514   44934 → 1234 [ACK] Seq=86433 Ack=1 Win=29312 Len=1448 TSval=3166296915 TSecr=505659562
    124 30.457271300   192.168.0.18          192.168.0.3           TCP      1514   44934 → 1234 [ACK] Seq=87881 Ack=1 Win=29312 Len=1448 TSval=3166296915 TSecr=505659562
    125 30.457746561   192.168.0.18          192.168.0.3           TCP      1514   44934 → 1234 [ACK] Seq=89329 Ack=1 Win=29312 Len=1448 TSval=3166296915 TSecr=505659562
    126 30.457757050   192.168.0.18          192.168.0.3           TCP      1514   44934 → 1234 [ACK] Seq=90777 Ack=1 Win=29312 Len=1448 TSval=3166296915 TSecr=505659562
    127 30.457768483   192.168.0.18          192.168.0.3           TCP      1514   44934 → 1234 [ACK] Seq=92225 Ack=1 Win=29312 Len=1448 TSval=3166296915 TSecr=505659562
    128 30.457784492   192.168.0.18          192.168.0.3           TCP      1514   44934 → 1234 [ACK] Seq=93673 Ack=1 Win=29312 Len=1448 TSval=3166296915 TSecr=505659562
    129 30.457862262   192.168.0.3           192.168.0.18          TCP      66     1234 → 44934 [ACK] Seq=1 Ack=73401 Win=168320 Len=0 TSval=505659587 TSecr=3166296914
    130 30.457894469   192.168.0.3           192.168.0.18          TCP      66     1234 → 44934 [ACK] Seq=1 Ack=74849 Win=171136 Len=0 TSval=505659587 TSecr=3166296914
    131 30.457903206   192.168.0.3           192.168.0.18          TCP      66     1234 → 44934 [ACK] Seq=1 Ack=76297 Win=174080 Len=0 TSval=505659587 TSecr=3166296914
    132 30.457913781   192.168.0.3           192.168.0.18          TCP      66     1234 → 44934 [ACK] Seq=1 Ack=77745 Win=176896 Len=0 TSval=505659587 TSecr=3166296915
    133 30.457919925   192.168.0.3           192.168.0.18          TCP      66     1234 → 44934 [ACK] Seq=1 Ack=79193 Win=179840 Len=0 TSval=505659587 TSecr=3166296915
    134 30.459466447   192.168.0.3           192.168.0.18          TCP      66     1234 → 44934 [ACK] Seq=1 Ack=80641 Win=182784 Len=0 TSval=505659588 TSecr=3166296915
    135 30.459497450   192.168.0.3           192.168.0.18          TCP      66     1234 → 44934 [ACK] Seq=1 Ack=82089 Win=185600 Len=0 TSval=505659588 TSecr=3166296915
    136 30.459506641   192.168.0.3           192.168.0.18          TCP      66     1234 → 44934 [ACK] Seq=1 Ack=83537 Win=185856 Len=0 TSval=505659588 TSecr=3166296915
    137 30.459517687   192.168.0.3           192.168.0.18          TCP      66     1234 → 44934 [ACK] Seq=1 Ack=84985 Win=185856 Len=0 TSval=505659588 TSecr=3166296915
    138 30.459523904   192.168.0.3           192.168.0.18          TCP      66     1234 → 44934 [ACK] Seq=1 Ack=86433 Win=185856 Len=0 TSval=505659588 TSecr=3166296915
    139 30.460757146   192.168.0.3           192.168.0.18          TCP      66     1234 → 44934 [ACK] Seq=1 Ack=87881 Win=185856 Len=0 TSval=505659588 TSecr=3166296915
    140 30.460778334   192.168.0.3           192.168.0.18          TCP      66     1234 → 44934 [ACK] Seq=1 Ack=92225 Win=194432 Len=0 TSval=505659588 TSecr=3166296915
    141 30.460798564   192.168.0.3           192.168.0.18          TCP      66     1234 → 44934 [ACK] Seq=1 Ack=93673 Win=197376 Len=0 TSval=505659588 TSecr=3166296915
    142 30.461852372   192.168.0.3           192.168.0.18          TCP      66     1234 → 44934 [ACK] Seq=1 Ack=95121 Win=200320 Len=0 TSval=505659588 TSecr=3166296915
    143 30.557896004   192.168.0.18          192.168.0.3           TCP      1514   44934 → 1234 [ACK] Seq=95121 Ack=1 Win=29312 Len=1448 TSval=3166296940 TSecr=505659587
    144 30.557920883   192.168.0.18          192.168.0.3           TCP      1514   44934 → 1234 [ACK] Seq=96569 Ack=1 Win=29312 Len=1448 TSval=3166296940 TSecr=505659587
    145 30.557923703   192.168.0.18          192.168.0.3           TCP      1514   44934 → 1234 [ACK] Seq=98017 Ack=1 Win=29312 Len=1448 TSval=3166296940 TSecr=505659587
    146 30.557931362   192.168.0.18          192.168.0.3           TCP      1514   44934 → 1234 [ACK] Seq=99465 Ack=1 Win=29312 Len=1448 TSval=3166296940 TSecr=505659587
    147 30.557932940   192.168.0.18          192.168.0.3           TCP      1514   44934 → 1234 [ACK] Seq=100913 Ack=1 Win=29312 Len=1448 TSval=3166296940 TSecr=505659587
    148 30.559531510   192.168.0.18          192.168.0.3           TCP      1514   [TCP Previous segment not captured] 44934 → 1234 [ACK] Seq=103809 Ack=1 Win=29312 Len=1448 TSval=3166296941 TSecr=505659588
    149 30.559538581   192.168.0.18          192.168.0.3           TCP      1514   44934 → 1234 [ACK] Seq=105257 Ack=1 Win=29312 Len=1448 TSval=3166296941 TSecr=505659588
    150 30.559544114   192.168.0.18          192.168.0.3           TCP      1514   44934 → 1234 [ACK] Seq=106705 Ack=1 Win=29312 Len=1448 TSval=3166296941 TSecr=505659588
    151 30.559545769   192.168.0.18          192.168.0.3           TCP      1514   44934 → 1234 [ACK] Seq=108153 Ack=1 Win=29312 Len=1448 TSval=3166296941 TSecr=505659588
    152 30.559655834   192.168.0.3           192.168.0.18          TCP      66     1234 → 44934 [ACK] Seq=1 Ack=96569 Win=203136 Len=0 TSval=505659613 TSecr=3166296940
    153 30.559687413   192.168.0.3           192.168.0.18          TCP      66     1234 → 44934 [ACK] Seq=1 Ack=98017 Win=206080 Len=0 TSval=505659613 TSecr=3166296940
    154 30.559700195   192.168.0.3           192.168.0.18          TCP      66     1234 → 44934 [ACK] Seq=1 Ack=99465 Win=209024 Len=0 TSval=505659613 TSecr=3166296940
    155 30.559709763   192.168.0.3           192.168.0.18          TCP      66     1234 → 44934 [ACK] Seq=1 Ack=100913 Win=211840 Len=0 TSval=505659613 TSecr=3166296940
    156 30.560809971   192.168.0.18          192.168.0.3           TCP      1514   44934 → 1234 [ACK] Seq=109601 Ack=1 Win=29312 Len=1448 TSval=3166296941 TSecr=505659588
    157 30.560816869   192.168.0.18          192.168.0.3           TCP      1514   44934 → 1234 [ACK] Seq=111049 Ack=1 Win=29312 Len=1448 TSval=3166296941 TSecr=505659588
    158 30.560818381   192.168.0.18          192.168.0.3           TCP      1514   44934 → 1234 [ACK] Seq=112497 Ack=1 Win=29312 Len=1448 TSval=3166296941 TSecr=505659588
    159 30.560819659   192.168.0.18          192.168.0.3           TCP      1514   44934 → 1234 [ACK] Seq=113945 Ack=1 Win=29312 Len=1448 TSval=3166296941 TSecr=505659588
    160 30.560824771   192.168.0.18          192.168.0.3           TCP      1514   44934 → 1234 [ACK] Seq=115393 Ack=1 Win=29312 Len=1448 TSval=3166296941 TSecr=505659588
    161 30.560826373   192.168.0.18          192.168.0.3           TCP      1514   44934 → 1234 [ACK] Seq=116841 Ack=1 Win=29312 Len=1448 TSval=3166296941 TSecr=505659588
    162 30.560920910   192.168.0.3           192.168.0.18          TCP      66     1234 → 44934 [ACK] Seq=1 Ack=102361 Win=214784 Len=0 TSval=505659613 TSecr=3166296940
    163 30.561885961   192.168.0.18          192.168.0.3           TCP      1514   44934 → 1234 [ACK] Seq=118289 Ack=1 Win=29312 Len=1448 TSval=3166296941 TSecr=505659588
    164 30.562420344   192.168.0.3           192.168.0.18          TCP      78     [TCP Window Update] 1234 → 44934 [ACK] Seq=1 Ack=102361 Win=220544 Len=0 TSval=505659613 TSecr=3166296940 SLE=103809 SRE=106705
    165 30.562454830   192.168.0.3           192.168.0.18          TCP      78     [TCP Window Update] 1234 → 44934 [ACK] Seq=1 Ack=102361 Win=223488 Len=0 TSval=505659613 TSecr=3166296940 SLE=103809 SRE=108153
    166 30.562471950   192.168.0.3           192.168.0.18          TCP      78     [TCP Window Update] 1234 → 44934 [ACK] Seq=1 Ack=102361 Win=226304 Len=0 TSval=505659614 TSecr=3166296940 SLE=103809 SRE=109601
    167 30.562481404   192.168.0.3           192.168.0.18          TCP      78     [TCP Window Update] 1234 → 44934 [ACK] Seq=1 Ack=102361 Win=229248 Len=0 TSval=505659614 TSecr=3166296940 SLE=103809 SRE=111049
    168 30.563673746   192.168.0.3           192.168.0.18          TCP      78     [TCP Window Update] 1234 → 44934 [ACK] Seq=1 Ack=102361 Win=232192 Len=0 TSval=505659614 TSecr=3166296940 SLE=103809 SRE=112497
    169 30.563698695   192.168.0.3           192.168.0.18          TCP      78     [TCP Window Update] 1234 → 44934 [ACK] Seq=1 Ack=102361 Win=235008 Len=0 TSval=505659614 TSecr=3166296940 SLE=103809 SRE=113945
    170 30.563717600   192.168.0.3           192.168.0.18          TCP      78     [TCP Window Update] 1234 → 44934 [ACK] Seq=1 Ack=102361 Win=240768 Len=0 TSval=505659614 TSecr=3166296940 SLE=103809 SRE=116841
    171 30.564852028   192.168.0.3           192.168.0.18          TCP      78     [TCP Window Update] 1234 → 44934 [ACK] Seq=1 Ack=102361 Win=246656 Len=0 TSval=505659614 TSecr=3166296940 SLE=103809 SRE=119737
    172 30.659688859   192.168.0.18          192.168.0.3           TCP      1514   44934 → 1234 [ACK] Seq=119737 Ack=1 Win=29312 Len=1448 TSval=3166296966 TSecr=505659613
    173 30.659723118   192.168.0.18          192.168.0.3           TCP      1514   [TCP Previous segment not captured] 44934 → 1234 [ACK] Seq=122633 Ack=1 Win=29312 Len=1448 TSval=3166296966 TSecr=505659613
    174 30.659724808   192.168.0.18          192.168.0.3           TCP      1514   44934 → 1234 [ACK] Seq=124081 Ack=1 Win=29312 Len=1448 TSval=3166296966 TSecr=505659613
    175 30.662085096   192.168.0.3           192.168.0.18          TCP      78     [TCP Window Update] 1234 → 44934 [ACK] Seq=1 Ack=102361 Win=249472 Len=0 TSval=505659639 TSecr=3166296940 SLE=103809 SRE=121185
    176 30.662135317   192.168.0.3           192.168.0.18          TCP      86     [TCP Window Update] 1234 → 44934 [ACK] Seq=1 Ack=102361 Win=252416 Len=0 TSval=505659639 TSecr=3166296940 SLE=122633 SRE=124081 SLE=103809 SRE=121185
    177 30.662149073   192.168.0.3           192.168.0.18          TCP      86     [TCP Window Update] 1234 → 44934 [ACK] Seq=1 Ack=102361 Win=255360 Len=0 TSval=505659639 TSecr=3166296940 SLE=122633 SRE=125529 SLE=103809 SRE=121185
    178 30.662474076   192.168.0.18          192.168.0.3           TCP      1514   [TCP Out-Of-Order] 44934 → 1234 [ACK] Seq=102361 Ack=1 Win=29312 Len=1448 TSval=3166296966 TSecr=505659613
    179 30.662491931   192.168.0.18          192.168.0.3           TCP      1514   [TCP Previous segment not captured] 44934 → 1234 [ACK] Seq=128425 Ack=1 Win=29312 Len=1448 TSval=3166296966 TSecr=505659614
    180 30.663725284   192.168.0.18          192.168.0.3           TCP      1514   44934 → 1234 [ACK] Seq=129873 Ack=1 Win=29312 Len=1448 TSval=3166296967 TSecr=505659614
    181 30.663736037   192.168.0.18          192.168.0.3           TCP      1514   44934 → 1234 [ACK] Seq=131321 Ack=1 Win=29312 Len=1448 TSval=3166296967 TSecr=505659614
    182 30.664890966   192.168.0.18          192.168.0.3           TCP      1514   44934 → 1234 [ACK] Seq=132769 Ack=1 Win=29312 Len=1448 TSval=3166296967 TSecr=505659614
    183 30.665874728   192.168.0.3           192.168.0.18          TCP      78     1234 → 44934 [ACK] Seq=1 Ack=121185 Win=258176 Len=0 TSval=505659639 TSecr=3166296966 SLE=122633 SRE=125529
    184 30.665900683   192.168.0.3           192.168.0.18          TCP      86     [TCP Window Update] 1234 → 44934 [ACK] Seq=1 Ack=121185 Win=261120 Len=0 TSval=505659639 TSecr=3166296966 SLE=128425 SRE=129873 SLE=122633 SRE=125529
    185 30.667139073   192.168.0.3           192.168.0.18          TCP      86     [TCP Window Update] 1234 → 44934 [ACK] Seq=1 Ack=121185 Win=266880 Len=0 TSval=505659640 TSecr=3166296966 SLE=128425 SRE=132769 SLE=122633 SRE=125529
    186 30.668275873   192.168.0.3           192.168.0.18          TCP      86     [TCP Window Update] 1234 → 44934 [ACK] Seq=1 Ack=121185 Win=269824 Len=0 TSval=505659640 TSecr=3166296966 SLE=128425 SRE=134217 SLE=122633 SRE=125529
    187 30.762172035   192.168.0.18          192.168.0.3           TCP      1514   44934 → 1234 [ACK] Seq=134217 Ack=1 Win=29312 Len=1448 TSval=3166296991 TSecr=505659639
    188 30.763460815   192.168.0.3           192.168.0.18          TCP      86     [TCP Window Update] 1234 → 44934 [ACK] Seq=1 Ack=121185 Win=272640 Len=0 TSval=505659664 TSecr=3166296966 SLE=128425 SRE=135665 SLE=122633 SRE=125529
    189 30.765956875   192.168.0.18          192.168.0.3           TCP      1514   [TCP Out-Of-Order] 44934 → 1234 [ACK] Seq=121185 Ack=1 Win=29312 Len=1448 TSval=3166296992 TSecr=505659639
    190 30.767212154   192.168.0.18          192.168.0.3           TCP      1514   [TCP Out-Of-Order] 44934 → 1234 [ACK] Seq=125529 Ack=1 Win=29312 Len=1448 TSval=3166296992 TSecr=505659640
    191 30.767221734   192.168.0.18          192.168.0.3           TCP      1514   [TCP Out-Of-Order] 44934 → 1234 [ACK] Seq=126977 Ack=1 Win=29312 Len=1448 TSval=3166296992 TSecr=505659640
    192 30.768334951   192.168.0.3           192.168.0.18          TCP      78     1234 → 44934 [ACK] Seq=1 Ack=125529 Win=275584 Len=0 TSval=505659665 TSecr=3166296992 SLE=128425 SRE=135665
    193 30.768381151   192.168.0.18          192.168.0.3           TCP      1514   44934 → 1234 [ACK] Seq=135665 Ack=1 Win=29312 Len=1448 TSval=3166296993 TSecr=505659640
    194 30.768394313   192.168.0.3           192.168.0.18          TCP      78     1234 → 44934 [ACK] Seq=1 Ack=126977 Win=278528 Len=0 TSval=505659665 TSecr=3166296992 SLE=128425 SRE=135665
    195 30.770649842   192.168.0.3           192.168.0.18          TCP      66     1234 → 44934 [ACK] Seq=1 Ack=135665 Win=281344 Len=0 TSval=505659665 TSecr=3166296992
    196 30.770688037   192.168.0.3           192.168.0.18          TCP      66     1234 → 44934 [ACK] Seq=1 Ack=137113 Win=283904 Len=0 TSval=505659665 TSecr=3166296993
    197 30.863538096   192.168.0.18          192.168.0.3           TCP      1514   44934 → 1234 [ACK] Seq=137113 Ack=1 Win=29312 Len=1448 TSval=3166297017 TSecr=505659664
    198 30.866935761   192.168.0.3           192.168.0.18          TCP      66     1234 → 44934 [ACK] Seq=1 Ack=138561 Win=283904 Len=0 TSval=505659690 TSecr=3166297017
    199 30.868425595   192.168.0.18          192.168.0.3           TCP      1514   44934 → 1234 [ACK] Seq=138561 Ack=1 Win=29312 Len=1448 TSval=3166297018 TSecr=505659665
    200 30.868439275   192.168.0.18          192.168.0.3           TCP      1514   44934 → 1234 [ACK] Seq=140009 Ack=1 Win=29312 Len=1448 TSval=3166297018 TSecr=505659665
    201 30.868441461   192.168.0.18          192.168.0.3           TCP      1514   44934 → 1234 [ACK] Seq=141457 Ack=1 Win=29312 Len=1448 TSval=3166297018 TSecr=505659665
    202 30.868442883   192.168.0.18          192.168.0.3           TCP      1514   44934 → 1234 [ACK] Seq=142905 Ack=1 Win=29312 Len=1448 TSval=3166297018 TSecr=505659665
    203 30.868447748   192.168.0.18          192.168.0.3           TCP      1514   44934 → 1234 [ACK] Seq=144353 Ack=1 Win=29312 Len=1448 TSval=3166297018 TSecr=505659665
    204 30.869669418   192.168.0.3           192.168.0.18          TCP      66     1234 → 44934 [ACK] Seq=1 Ack=141457 Win=283904 Len=0 TSval=505659691 TSecr=3166297018
    205 30.870167016   192.168.0.3           192.168.0.18          TCP      66     1234 → 44934 [ACK] Seq=1 Ack=142905 Win=283904 Len=0 TSval=505659691 TSecr=3166297018
    206 30.870206090   192.168.0.3           192.168.0.18          TCP      66     1234 → 44934 [ACK] Seq=1 Ack=144353 Win=283904 Len=0 TSval=505659691 TSecr=3166297018
    207 30.870722510   192.168.0.18          192.168.0.3           TCP      1514   44934 → 1234 [ACK] Seq=145801 Ack=1 Win=29312 Len=1448 TSval=3166297018 TSecr=505659665
    208 30.870730590   192.168.0.18          192.168.0.3           TCP      1514   44934 → 1234 [ACK] Seq=147249 Ack=1 Win=29312 Len=1448 TSval=3166297018 TSecr=505659665
    209 30.871340113   192.168.0.3           192.168.0.18          TCP      66     1234 → 44934 [ACK] Seq=1 Ack=145801 Win=283904 Len=0 TSval=505659691 TSecr=3166297018
    210 30.873076421   192.168.0.3           192.168.0.18          TCP      66     1234 → 44934 [ACK] Seq=1 Ack=147249 Win=283904 Len=0 TSval=505659691 TSecr=3166297018
    211 30.873116740   192.168.0.3           192.168.0.18          TCP      66     1234 → 44934 [ACK] Seq=1 Ack=148697 Win=283904 Len=0 TSval=505659691 TSecr=3166297018
    212 30.966999052   192.168.0.18          192.168.0.3           TCP      1514   44934 → 1234 [ACK] Seq=148697 Ack=1 Win=29312 Len=1448 TSval=3166297042 TSecr=505659690
    213 30.969762911   192.168.0.18          192.168.0.3           TCP      1514   44934 → 1234 [ACK] Seq=150145 Ack=1 Win=29312 Len=1448 TSval=3166297043 TSecr=505659691
    214 30.969776267   192.168.0.18          192.168.0.3           TCP      1514   44934 → 1234 [ACK] Seq=151593 Ack=1 Win=29312 Len=1448 TSval=3166297043 TSecr=505659691
    215 30.970240765   192.168.0.18          192.168.0.3           TCP      1514   44934 → 1234 [ACK] Seq=153041 Ack=1 Win=29312 Len=1448 TSval=3166297043 TSecr=505659691
    216 30.970249262   192.168.0.18          192.168.0.3           TCP      1514   44934 → 1234 [ACK] Seq=154489 Ack=1 Win=29312 Len=1448 TSval=3166297043 TSecr=505659691
    217 30.970406943   192.168.0.3           192.168.0.18          TCP      66     1234 → 44934 [ACK] Seq=1 Ack=150145 Win=283904 Len=0 TSval=505659715 TSecr=3166297042
    218 30.971411690   192.168.0.18          192.168.0.3           TCP      1514   44934 → 1234 [ACK] Seq=155937 Ack=1 Win=29312 Len=1448 TSval=3166297044 TSecr=505659691
    219 30.971424629   192.168.0.18          192.168.0.3           TCP      1514   44934 → 1234 [ACK] Seq=157385 Ack=1 Win=29312 Len=1448 TSval=3166297044 TSecr=505659691
    220 30.972125766   192.168.0.3           192.168.0.18          TCP      66     1234 → 44934 [ACK] Seq=1 Ack=153041 Win=283904 Len=0 TSval=505659716 TSecr=3166297043
    221 30.972577476   192.168.0.3           192.168.0.18          TCP      66     1234 → 44934 [ACK] Seq=1 Ack=155937 Win=283904 Len=0 TSval=505659716 TSecr=3166297043
    222 30.972636513   192.168.0.3           192.168.0.18          TCP      66     1234 → 44934 [ACK] Seq=1 Ack=157385 Win=283904 Len=0 TSval=505659716 TSecr=3166297044
    223 30.972647180   192.168.0.3           192.168.0.18          TCP      66     1234 → 44934 [ACK] Seq=1 Ack=158833 Win=283904 Len=0 TSval=505659716 TSecr=3166297044
    224 30.973154523   192.168.0.18          192.168.0.3           TCP      1514   44934 → 1234 [ACK] Seq=158833 Ack=1 Win=29312 Len=1448 TSval=3166297044 TSecr=505659691
    225 30.973164835   192.168.0.18          192.168.0.3           TCP      1514   44934 → 1234 [ACK] Seq=160281 Ack=1 Win=29312 Len=1448 TSval=3166297044 TSecr=505659691
    226 30.976558813   192.168.0.3           192.168.0.18          TCP      66     1234 → 44934 [ACK] Seq=1 Ack=161729 Win=283904 Len=0 TSval=505659717 TSecr=3166297044
    227 31.070461039   192.168.0.18          192.168.0.3           TCP      1514   44934 → 1234 [ACK] Seq=161729 Ack=1 Win=29312 Len=1448 TSval=3166297068 TSecr=505659715
    228 31.072217111   192.168.0.18          192.168.0.3           TCP      1514   44934 → 1234 [ACK] Seq=163177 Ack=1 Win=29312 Len=1448 TSval=3166297069 TSecr=505659716
    229 31.072230570   192.168.0.18          192.168.0.3           TCP      1514   44934 → 1234 [ACK] Seq=164625 Ack=1 Win=29312 Len=1448 TSval=3166297069 TSecr=505659716
    230 31.072636323   192.168.0.18          192.168.0.3           TCP      1514   44934 → 1234 [ACK] Seq=166073 Ack=1 Win=29312 Len=1448 TSval=3166297069 TSecr=505659716
    231 31.072640452   192.168.0.18          192.168.0.3           TCP      1514   44934 → 1234 [ACK] Seq=167521 Ack=1 Win=29312 Len=1448 TSval=3166297069 TSecr=505659716
    232 31.072663283   192.168.0.18          192.168.0.3           TCP      1514   44934 → 1234 [ACK] Seq=168969 Ack=1 Win=29312 Len=1448 TSval=3166297069 TSecr=505659716
    233 31.072666143   192.168.0.18          192.168.0.3           TCP      1514   44934 → 1234 [ACK] Seq=170417 Ack=1 Win=29312 Len=1448 TSval=3166297069 TSecr=505659716
    234 31.072667685   192.168.0.18          192.168.0.3           TCP      1514   44934 → 1234 [ACK] Seq=171865 Ack=1 Win=29312 Len=1448 TSval=3166297069 TSecr=505659716
    235 31.073379882   192.168.0.3           192.168.0.18          TCP      66     1234 → 44934 [ACK] Seq=1 Ack=163177 Win=283904 Len=0 TSval=505659741 TSecr=3166297068
    236 31.073428117   192.168.0.3           192.168.0.18          TCP      66     1234 → 44934 [ACK] Seq=1 Ack=164625 Win=283904 Len=0 TSval=505659742 TSecr=3166297069
    237 31.074990428   192.168.0.3           192.168.0.18          TCP      66     1234 → 44934 [ACK] Seq=1 Ack=167521 Win=283904 Len=0 TSval=505659742 TSecr=3166297069
    238 31.075052286   192.168.0.3           192.168.0.18          TCP      66     1234 → 44934 [ACK] Seq=1 Ack=170417 Win=283904 Len=0 TSval=505659742 TSecr=3166297069
    239 31.076498557   192.168.0.3           192.168.0.18          TCP      66     1234 → 44934 [ACK] Seq=1 Ack=173313 Win=283904 Len=0 TSval=505659742 TSecr=3166297069
    240 31.076625240   192.168.0.18          192.168.0.3           TCP      1514   44934 → 1234 [ACK] Seq=173313 Ack=1 Win=29312 Len=1448 TSval=3166297070 TSecr=505659717
    241 31.076633257   192.168.0.18          192.168.0.3           TCP      1514   44934 → 1234 [ACK] Seq=174761 Ack=1 Win=29312 Len=1448 TSval=3166297070 TSecr=505659717
    242 31.078938458   192.168.0.3           192.168.0.18          TCP      66     1234 → 44934 [ACK] Seq=1 Ack=176209 Win=283904 Len=0 TSval=505659743 TSecr=3166297070
    243 31.173429554   192.168.0.18          192.168.0.3           TCP      1514   44934 → 1234 [ACK] Seq=176209 Ack=1 Win=29312 Len=1448 TSval=3166297094 TSecr=505659741
    244 31.173444826   192.168.0.18          192.168.0.3           TCP      1514   44934 → 1234 [ACK] Seq=177657 Ack=1 Win=29312 Len=1448 TSval=3166297094 TSecr=505659742
    245 31.175054234   192.168.0.18          192.168.0.3           TCP      1514   44934 → 1234 [ACK] Seq=179105 Ack=1 Win=29312 Len=1448 TSval=3166297094 TSecr=505659742
    246 31.175057638   192.168.0.18          192.168.0.3           TCP      1514   44934 → 1234 [ACK] Seq=180553 Ack=1 Win=29312 Len=1448 TSval=3166297094 TSecr=505659742
    247 31.175070423   192.168.0.18          192.168.0.3           TCP      1514   44934 → 1234 [ACK] Seq=182001 Ack=1 Win=29312 Len=1448 TSval=3166297094 TSecr=505659742
    248 31.175072179   192.168.0.18          192.168.0.3           TCP      1514   44934 → 1234 [ACK] Seq=183449 Ack=1 Win=29312 Len=1448 TSval=3166297094 TSecr=505659742
    249 31.175784076   192.168.0.3           192.168.0.18          TCP      66     1234 → 44934 [ACK] Seq=1 Ack=179105 Win=283904 Len=0 TSval=505659767 TSecr=3166297094
    250 31.176535073   192.168.0.3           192.168.0.18          TCP      66     1234 → 44934 [ACK] Seq=1 Ack=182001 Win=283904 Len=0 TSval=505659767 TSecr=3166297094
    251 31.176559256   192.168.0.18          192.168.0.3           TCP      1514   44934 → 1234 [ACK] Seq=184897 Ack=1 Win=29312 Len=1448 TSval=3166297095 TSecr=505659742
    252 31.176561401   192.168.0.18          192.168.0.3           TCP      1514   44934 → 1234 [ACK] Seq=186345 Ack=1 Win=29312 Len=1448 TSval=3166297095 TSecr=505659742
    253 31.176563613   192.168.0.18          192.168.0.3           TCP      1514   44934 → 1234 [ACK] Seq=187793 Ack=1 Win=29312 Len=1448 TSval=3166297095 TSecr=505659742
    254 31.177929899   192.168.0.3           192.168.0.18          TCP      66     1234 → 44934 [ACK] Seq=1 Ack=184897 Win=283904 Len=0 TSval=505659768 TSecr=3166297094
    255 31.177941843   192.168.0.3           192.168.0.18          TCP      66     1234 → 44934 [ACK] Seq=1 Ack=187793 Win=283904 Len=0 TSval=505659768 TSecr=3166297095
    256 31.178995512   192.168.0.18          192.168.0.3           TCP      1514   44934 → 1234 [ACK] Seq=189241 Ack=1 Win=29312 Len=1448 TSval=3166297095 TSecr=505659743
    257 31.178998360   192.168.0.18          192.168.0.3           TCP      1514   44934 → 1234 [ACK] Seq=190689 Ack=1 Win=29312 Len=1448 TSval=3166297095 TSecr=505659743
    258 31.182245193   192.168.0.3           192.168.0.18          TCP      66     1234 → 44934 [ACK] Seq=1 Ack=190689 Win=283904 Len=0 TSval=505659769 TSecr=3166297095
    259 31.226043590   192.168.0.3           192.168.0.18          TCP      66     1234 → 44934 [ACK] Seq=1 Ack=192137 Win=283904 Len=0 TSval=505659780 TSecr=3166297095
    260 31.275829546   192.168.0.18          192.168.0.3           TCP      1514   44934 → 1234 [ACK] Seq=192137 Ack=1 Win=29312 Len=1448 TSval=3166297120 TSecr=505659767
    261 31.275841384   192.168.0.18          192.168.0.3           TCP      1514   44934 → 1234 [ACK] Seq=193585 Ack=1 Win=29312 Len=1448 TSval=3166297120 TSecr=505659767
    262 31.276551031   192.168.0.18          192.168.0.3           TCP      1514   44934 → 1234 [ACK] Seq=195033 Ack=1 Win=29312 Len=1448 TSval=3166297120 TSecr=505659767
    263 31.276553207   192.168.0.18          192.168.0.3           TCP      1514   44934 → 1234 [ACK] Seq=196481 Ack=1 Win=29312 Len=1448 TSval=3166297120 TSecr=505659767
    264 31.277699476   192.168.0.3           192.168.0.18          TCP      66     1234 → 44934 [ACK] Seq=1 Ack=195033 Win=283904 Len=0 TSval=505659793 TSecr=3166297120
    265 31.277944021   192.168.0.18          192.168.0.3           TCP      1514   44934 → 1234 [ACK] Seq=197929 Ack=1 Win=29312 Len=1448 TSval=3166297120 TSecr=505659768
    266 31.277946634   192.168.0.18          192.168.0.3           TCP      690    44934 → 1234 [FIN, PSH, ACK] Seq=199377 Ack=1 Win=29312 Len=624 TSval=3166297120 TSecr=505659768
    267 31.280090708   192.168.0.3           192.168.0.18          TCP      66     1234 → 44934 [ACK] Seq=1 Ack=197929 Win=283904 Len=0 TSval=505659793 TSecr=3166297120
    268 31.280100297   192.168.0.3           192.168.0.18          TCP      66     1234 → 44934 [ACK] Seq=1 Ack=200002 Win=283904 Len=0 TSval=505659793 TSecr=3166297120
    269 31.281658813   192.168.0.3           192.168.0.18          TCP      66     1234 → 44934 [FIN, ACK] Seq=1 Ack=200002 Win=283904 Len=0 TSval=505659793 TSecr=3166297120
    270 31.381690889   192.168.0.18          192.168.0.3           TCP      66     44934 → 1234 [ACK] Seq=200002 Ack=2 Win=29312 Len=0 TSval=3166297146 TSecr=505659793
