     38 24.402323449   192.168.0.18          192.168.0.3           TCP      74     44928 → 1234 [SYN] Seq=0 Win=29200 Len=0 MSS=1460 SACK_PERM=1 TSval=3166198938 TSecr=0 WS=128
     39 24.405080160   192.168.0.3           192.168.0.18          TCP      74     1234 → 44928 [SYN, ACK] Seq=0 Ack=1 Win=28960 Len=0 MSS=1460 SACK_PERM=1 TSval=505561664 TSecr=3166198938 WS=128
     40 24.905159755   192.168.0.18          192.168.0.3           TCP      66     44928 → 1234 [ACK] Seq=1 Ack=1 Win=29312 Len=0 TSval=3166199064 TSecr=505561664
     41 24.905291580   192.168.0.18          192.168.0.3           TCP      1066   44928 → 1234 [PSH, ACK] Seq=1 Ack=1 Win=29312 Len=1000 TSval=3166199064 TSecr=505561664
     42 24.905320122   192.168.0.18          192.168.0.3           TCP      1514   44928 → 1234 [ACK] Seq=1001 Ack=1 Win=29312 Len=1448 TSval=3166199064 TSecr=505561664
     43 24.905329720   192.168.0.18          192.168.0.3           TCP      1514   44928 → 1234 [ACK] Seq=2449 Ack=1 Win=29312 Len=1448 TSval=3166199064 TSecr=505561664
     44 24.905340187   192.168.0.18          192.168.0.3           TCP      1514   44928 → 1234 [ACK] Seq=3897 Ack=1 Win=29312 Len=1448 TSval=3166199064 TSecr=505561664
     45 24.905349447   192.168.0.18          192.168.0.3           TCP      1514   44928 → 1234 [ACK] Seq=5345 Ack=1 Win=29312 Len=1448 TSval=3166199064 TSecr=505561664
     46 24.905361379   192.168.0.18          192.168.0.3           TCP      1514   44928 → 1234 [ACK] Seq=6793 Ack=1 Win=29312 Len=1448 TSval=3166199064 TSecr=505561664
     47 24.905367141   192.168.0.18          192.168.0.3           TCP      1514   44928 → 1234 [ACK] Seq=8241 Ack=1 Win=29312 Len=1448 TSval=3166199064 TSecr=505561664
     48 24.905404215   192.168.0.18          192.168.0.3           TCP      1514   44928 → 1234 [ACK] Seq=9689 Ack=1 Win=29312 Len=1448 TSval=3166199064 TSecr=505561664
     49 24.905408365   192.168.0.18          192.168.0.3           TCP      1514   44928 → 1234 [ACK] Seq=11137 Ack=1 Win=29312 Len=1448 TSval=3166199064 TSecr=505561664
     50 24.905410187   192.168.0.18          192.168.0.3           TCP      1514   44928 → 1234 [ACK] Seq=12585 Ack=1 Win=29312 Len=1448 TSval=3166199064 TSecr=505561664
     51 24.906454962   192.168.0.3           192.168.0.18          TCP      66     1234 → 44928 [ACK] Seq=1 Ack=1001 Win=32128 Len=0 TSval=505561793 TSecr=3166199064
     52 24.906515525   192.168.0.3           192.168.0.18          TCP      66     1234 → 44928 [ACK] Seq=1 Ack=2449 Win=35072 Len=0 TSval=505561793 TSecr=3166199064
     53 24.906769903   192.168.0.3           192.168.0.18          TCP      66     1234 → 44928 [ACK] Seq=1 Ack=3897 Win=37888 Len=0 TSval=505561793 TSecr=3166199064
     54 24.907441925   192.168.0.3           192.168.0.18          TCP      66     1234 → 44928 [ACK] Seq=1 Ack=5345 Win=40832 Len=0 TSval=505561793 TSecr=3166199064
     55 24.907500110   192.168.0.3           192.168.0.18          TCP      66     1234 → 44928 [ACK] Seq=1 Ack=6793 Win=43776 Len=0 TSval=505561793 TSecr=3166199064
     56 24.907515473   192.168.0.3           192.168.0.18          TCP      66     1234 → 44928 [ACK] Seq=1 Ack=8241 Win=46592 Len=0 TSval=505561793 TSecr=3166199064
     57 24.908597388   192.168.0.3           192.168.0.18          TCP      66     1234 → 44928 [ACK] Seq=1 Ack=9689 Win=49536 Len=0 TSval=505561793 TSecr=3166199064
     58 24.908656643   192.168.0.3           192.168.0.18          TCP      66     1234 → 44928 [ACK] Seq=1 Ack=11137 Win=52480 Len=0 TSval=505561793 TSecr=3166199064
     59 24.908672665   192.168.0.3           192.168.0.18          TCP      66     1234 → 44928 [ACK] Seq=1 Ack=12585 Win=55296 Len=0 TSval=505561793 TSecr=3166199064
     60 24.908684667   192.168.0.3           192.168.0.18          TCP      66     1234 → 44928 [ACK] Seq=1 Ack=14033 Win=58240 Len=0 TSval=505561793 TSecr=3166199064
     65 25.406533568   192.168.0.18          192.168.0.3           TCP      1514   44928 → 1234 [ACK] Seq=14033 Ack=1 Win=29312 Len=1448 TSval=3166199189 TSecr=505561793
     66 25.406546932   192.168.0.18          192.168.0.3           TCP      1514   44928 → 1234 [ACK] Seq=15481 Ack=1 Win=29312 Len=1448 TSval=3166199189 TSecr=505561793
     67 25.406556349   192.168.0.18          192.168.0.3           TCP      1514   44928 → 1234 [ACK] Seq=16929 Ack=1 Win=29312 Len=1448 TSval=3166199189 TSecr=505561793
     68 25.406558968   192.168.0.18          192.168.0.3           TCP      1514   44928 → 1234 [ACK] Seq=18377 Ack=1 Win=29312 Len=1448 TSval=3166199189 TSecr=505561793
     69 25.406810935   192.168.0.18          192.168.0.3           TCP      1514   44928 → 1234 [ACK] Seq=19825 Ack=1 Win=29312 Len=1448 TSval=3166199189 TSecr=505561793
     70 25.406816048   192.168.0.18          192.168.0.3           TCP      1514   44928 → 1234 [ACK] Seq=21273 Ack=1 Win=29312 Len=1448 TSval=3166199189 TSecr=505561793
     71 25.407504309   192.168.0.18          192.168.0.3           TCP      1514   44928 → 1234 [ACK] Seq=22721 Ack=1 Win=29312 Len=1448 TSval=3166199189 TSecr=505561793
     72 25.407510342   192.168.0.18          192.168.0.3           TCP      1514   44928 → 1234 [ACK] Seq=24169 Ack=1 Win=29312 Len=1448 TSval=3166199189 TSecr=505561793
     73 25.407519632   192.168.0.18          192.168.0.3           TCP      1514   44928 → 1234 [ACK] Seq=25617 Ack=1 Win=29312 Len=1448 TSval=3166199189 TSecr=505561793
     74 25.407522137   192.168.0.18          192.168.0.3           TCP      1514   44928 → 1234 [ACK] Seq=27065 Ack=1 Win=29312 Len=1448 TSval=3166199189 TSecr=505561793
     75 25.407530307   192.168.0.18          192.168.0.3           TCP      1514   44928 → 1234 [ACK] Seq=28513 Ack=1 Win=29312 Len=1448 TSval=3166199189 TSecr=505561793
     76 25.407532397   192.168.0.18          192.168.0.3           TCP      1514   44928 → 1234 [ACK] Seq=29961 Ack=1 Win=29312 Len=1448 TSval=3166199189 TSecr=505561793
     77 25.408658819   192.168.0.18          192.168.0.3           TCP      1514   44928 → 1234 [ACK] Seq=31409 Ack=1 Win=29312 Len=1448 TSval=3166199190 TSecr=505561793
     78 25.408663875   192.168.0.18          192.168.0.3           TCP      1514   44928 → 1234 [ACK] Seq=32857 Ack=1 Win=29312 Len=1448 TSval=3166199190 TSecr=505561793
     79 25.408673373   192.168.0.18          192.168.0.3           TCP      1514   44928 → 1234 [ACK] Seq=34305 Ack=1 Win=29312 Len=1448 TSval=3166199190 TSecr=505561793
     80 25.408675135   192.168.0.18          192.168.0.3           TCP      1514   44928 → 1234 [ACK] Seq=35753 Ack=1 Win=29312 Len=1448 TSval=3166199190 TSecr=505561793
     81 25.408685642   192.168.0.18          192.168.0.3           TCP      1514   44928 → 1234 [ACK] Seq=37201 Ack=1 Win=29312 Len=1448 TSval=3166199190 TSecr=505561793
     82 25.408687328   192.168.0.18          192.168.0.3           TCP      1514   44928 → 1234 [ACK] Seq=38649 Ack=1 Win=29312 Len=1448 TSval=3166199190 TSecr=505561793
     83 25.408695347   192.168.0.18          192.168.0.3           TCP      1514   44928 → 1234 [ACK] Seq=40097 Ack=1 Win=29312 Len=1448 TSval=3166199190 TSecr=505561793
     84 25.408849828   192.168.0.18          192.168.0.3           TCP      1514   44928 → 1234 [ACK] Seq=41545 Ack=1 Win=29312 Len=1448 TSval=3166199190 TSecr=505561793
     85 26.436500960   192.168.0.18          192.168.0.3           TCP      1514   44928 → 1234 [ACK] Seq=42993 Ack=1 Win=29312 Len=1448 TSval=3166199447 TSecr=505561793
     86 27.972514645   192.168.0.18          192.168.0.3           TCP      1514   [TCP Retransmission] 44928 → 1234 [ACK] Seq=14033 Ack=1 Win=29312 Len=1448 TSval=3166199831 TSecr=505561793
     89 31.140473063   192.168.0.18          192.168.0.3           TCP      1514   [TCP Retransmission] 44928 → 1234 [ACK] Seq=14033 Ack=1 Win=29312 Len=1448 TSval=3166200623 TSecr=505561793
     92 37.284506173   192.168.0.18          192.168.0.3           TCP      1514   [TCP Retransmission] 44928 → 1234 [ACK] Seq=14033 Ack=1 Win=29312 Len=1448 TSval=3166202159 TSecr=505561793
     93 40.287182873   192.168.0.17          192.168.0.18          ICMP     590    Destination unreachable (Host unreachable)
     96 43.428486612   192.168.0.18          192.168.0.3           TCP      1514   [TCP Retransmission] 44928 → 1234 [ACK] Seq=14033 Ack=1 Win=29312 Len=1448 TSval=3166203695 TSecr=505561793
     99 46.431290140   192.168.0.17          192.168.0.18          ICMP     590    Destination unreachable (Host unreachable)
    102 49.572516504   192.168.0.18          192.168.0.3           TCP      1514   [TCP Retransmission] 44928 → 1234 [ACK] Seq=14033 Ack=1 Win=29312 Len=1448 TSval=3166205231 TSecr=505561793
    107 52.574332140   192.168.0.17          192.168.0.18          ICMP     590    Destination unreachable (Host unreachable)
    114 55.716483571   192.168.0.18          192.168.0.3           TCP      1514   [TCP Retransmission] 44928 → 1234 [ACK] Seq=14033 Ack=1 Win=29312 Len=1448 TSval=3166206767 TSecr=505561793
    115 58.718414978   192.168.0.17          192.168.0.18          ICMP     590    Destination unreachable (Host unreachable)
    116 61.860514844   192.168.0.18          192.168.0.3           TCP      1514   [TCP Retransmission] 44928 → 1234 [ACK] Seq=14033 Ack=1 Win=29312 Len=1448 TSval=3166208303 TSecr=505561793
    121 64.861498101   192.168.0.17          192.168.0.18          ICMP     590    Destination unreachable (Host unreachable)
    122 68.004521387   192.168.0.18          192.168.0.3           TCP      1514   [TCP Retransmission] 44928 → 1234 [ACK] Seq=14033 Ack=1 Win=29312 Len=1448 TSval=3166209839 TSecr=505561793
    127 80.292526677   192.168.0.18          192.168.0.3           TCP      1514   [TCP Retransmission] 44928 → 1234 [ACK] Seq=14033 Ack=1 Win=29312 Len=1448 TSval=3166212911 TSecr=505561793
    128 80.294839820   192.168.0.3           192.168.0.18          TCP      78     1234 → 44928 [ACK] Seq=1 Ack=44441 Win=119040 Len=0 TSval=505575640 TSecr=3166199447 SLE=14033 SRE=15481
    129 80.794978200   192.168.0.18          192.168.0.3           TCP      1514   44928 → 1234 [ACK] Seq=44441 Ack=1 Win=29312 Len=1448 TSval=3166213036 TSecr=505575640
    130 80.794991633   192.168.0.18          192.168.0.3           TCP      1514   44928 → 1234 [ACK] Seq=45889 Ack=1 Win=29312 Len=1448 TSval=3166213036 TSecr=505575640
    131 80.794994810   192.168.0.18          192.168.0.3           TCP      1514   44928 → 1234 [ACK] Seq=47337 Ack=1 Win=29312 Len=1448 TSval=3166213036 TSecr=505575640
    132 80.794996392   192.168.0.18          192.168.0.3           TCP      1514   44928 → 1234 [ACK] Seq=48785 Ack=1 Win=29312 Len=1448 TSval=3166213036 TSecr=505575640
    133 80.794997700   192.168.0.18          192.168.0.3           TCP      1514   44928 → 1234 [ACK] Seq=50233 Ack=1 Win=29312 Len=1448 TSval=3166213036 TSecr=505575640
    134 80.794999021   192.168.0.18          192.168.0.3           TCP      1514   44928 → 1234 [ACK] Seq=51681 Ack=1 Win=29312 Len=1448 TSval=3166213036 TSecr=505575640
    135 80.795000445   192.168.0.18          192.168.0.3           TCP      1514   44928 → 1234 [ACK] Seq=53129 Ack=1 Win=29312 Len=1448 TSval=3166213036 TSecr=505575640
    136 80.795299798   192.168.0.18          192.168.0.3           TCP      1514   44928 → 1234 [ACK] Seq=54577 Ack=1 Win=29312 Len=1448 TSval=3166213036 TSecr=505575640
    137 80.795319458   192.168.0.18          192.168.0.3           TCP      1514   44928 → 1234 [ACK] Seq=56025 Ack=1 Win=29312 Len=1448 TSval=3166213036 TSecr=505575640
    138 80.795322150   192.168.0.18          192.168.0.3           TCP      1514   44928 → 1234 [ACK] Seq=57473 Ack=1 Win=29312 Len=1448 TSval=3166213036 TSecr=505575640
    139 80.795323980   192.168.0.18          192.168.0.3           TCP      1514   44928 → 1234 [ACK] Seq=58921 Ack=1 Win=29312 Len=1448 TSval=3166213036 TSecr=505575640
    140 80.795325702   192.168.0.18          192.168.0.3           TCP      1514   44928 → 1234 [ACK] Seq=60369 Ack=1 Win=29312 Len=1448 TSval=3166213036 TSecr=505575640
    141 80.795563786   192.168.0.18          192.168.0.3           TCP      1514   44928 → 1234 [ACK] Seq=61817 Ack=1 Win=29312 Len=1448 TSval=3166213036 TSecr=505575640
    142 80.795591676   192.168.0.18          192.168.0.3           TCP      1514   44928 → 1234 [ACK] Seq=63265 Ack=1 Win=29312 Len=1448 TSval=3166213036 TSecr=505575640
    143 80.795595221   192.168.0.18          192.168.0.3           TCP      1514   44928 → 1234 [ACK] Seq=64713 Ack=1 Win=29312 Len=1448 TSval=3166213036 TSecr=505575640
    144 80.795805298   192.168.0.18          192.168.0.3           TCP      1514   44928 → 1234 [ACK] Seq=66161 Ack=1 Win=29312 Len=1448 TSval=3166213036 TSecr=505575640
    145 80.795814063   192.168.0.18          192.168.0.3           TCP      1514   44928 → 1234 [ACK] Seq=67609 Ack=1 Win=29312 Len=1448 TSval=3166213036 TSecr=505575640
    146 80.796051629   192.168.0.18          192.168.0.3           TCP      1514   44928 → 1234 [ACK] Seq=69057 Ack=1 Win=29312 Len=1448 TSval=3166213036 TSecr=505575640
    147 80.796059929   192.168.0.18          192.168.0.3           TCP      1514   44928 → 1234 [PSH, ACK] Seq=70505 Ack=1 Win=29312 Len=1448 TSval=3166213036 TSecr=505575640
    148 80.796293750   192.168.0.18          192.168.0.3           TCP      114    44928 → 1234 [PSH, ACK] Seq=71953 Ack=1 Win=29312 Len=48 TSval=3166213036 TSecr=505575640
    149 80.796302003   192.168.0.18          192.168.0.3           TCP      1514   44928 → 1234 [ACK] Seq=72001 Ack=1 Win=29312 Len=1448 TSval=3166213036 TSecr=505575640
    150 80.796549495   192.168.0.3           192.168.0.18          TCP      66     1234 → 44928 [ACK] Seq=1 Ack=47337 Win=124800 Len=0 TSval=505575765 TSecr=3166213036
    151 80.796599429   192.168.0.18          192.168.0.3           TCP      1514   44928 → 1234 [ACK] Seq=73449 Ack=1 Win=29312 Len=1448 TSval=3166213036 TSecr=505575640
    152 80.796606349   192.168.0.18          192.168.0.3           TCP      1514   44928 → 1234 [ACK] Seq=74897 Ack=1 Win=29312 Len=1448 TSval=3166213036 TSecr=505575640
    153 80.796621147   192.168.0.3           192.168.0.18          TCP      66     1234 → 44928 [ACK] Seq=1 Ack=50233 Win=130560 Len=0 TSval=505575766 TSecr=3166213036
    154 80.796791535   192.168.0.18          192.168.0.3           TCP      1514   44928 → 1234 [ACK] Seq=76345 Ack=1 Win=29312 Len=1448 TSval=3166213036 TSecr=505575640
    155 80.796800755   192.168.0.18          192.168.0.3           TCP      1514   44928 → 1234 [ACK] Seq=77793 Ack=1 Win=29312 Len=1448 TSval=3166213036 TSecr=505575640
    156 80.797058349   192.168.0.3           192.168.0.18          TCP      66     1234 → 44928 [ACK] Seq=1 Ack=51681 Win=133504 Len=0 TSval=505575766 TSecr=3166213036
    157 80.797114768   192.168.0.18          192.168.0.3           TCP      1514   44928 → 1234 [ACK] Seq=79241 Ack=1 Win=29312 Len=1448 TSval=3166213036 TSecr=505575640
    158 80.797122035   192.168.0.18          192.168.0.3           TCP      1514   44928 → 1234 [ACK] Seq=80689 Ack=1 Win=29312 Len=1448 TSval=3166213036 TSecr=505575640
    159 80.797126389   192.168.0.18          192.168.0.3           TCP      1514   44928 → 1234 [ACK] Seq=82137 Ack=1 Win=29312 Len=1448 TSval=3166213036 TSecr=505575640
    160 80.797135542   192.168.0.3           192.168.0.18          TCP      66     1234 → 44928 [ACK] Seq=1 Ack=53129 Win=136448 Len=0 TSval=505575766 TSecr=3166213036
    161 80.797151163   192.168.0.3           192.168.0.18          TCP      66     1234 → 44928 [ACK] Seq=1 Ack=54577 Win=139264 Len=0 TSval=505575766 TSecr=3166213036
    162 80.797274157   192.168.0.18          192.168.0.3           TCP      1514   44928 → 1234 [ACK] Seq=83585 Ack=1 Win=29312 Len=1448 TSval=3166213036 TSecr=505575640
    163 80.797285812   192.168.0.18          192.168.0.3           TCP      1514   44928 → 1234 [ACK] Seq=85033 Ack=1 Win=29312 Len=1448 TSval=3166213036 TSecr=505575640
    164 80.797534156   192.168.0.18          192.168.0.3           TCP      1514   44928 → 1234 [ACK] Seq=86481 Ack=1 Win=29312 Len=1448 TSval=3166213036 TSecr=505575640
    165 80.797544456   192.168.0.18          192.168.0.3           TCP      1514   44928 → 1234 [ACK] Seq=87929 Ack=1 Win=29312 Len=1448 TSval=3166213036 TSecr=505575640
    166 80.797767732   192.168.0.3           192.168.0.18          TCP      66     1234 → 44928 [ACK] Seq=1 Ack=56025 Win=142208 Len=0 TSval=505575766 TSecr=3166213036
    167 80.797799525   192.168.0.18          192.168.0.3           TCP      1514   44928 → 1234 [ACK] Seq=89377 Ack=1 Win=29312 Len=1448 TSval=3166213036 TSecr=505575640
    168 80.797806307   192.168.0.18          192.168.0.3           TCP      1514   44928 → 1234 [ACK] Seq=90825 Ack=1 Win=29312 Len=1448 TSval=3166213036 TSecr=505575640
    169 80.797815223   192.168.0.3           192.168.0.18          TCP      66     1234 → 44928 [ACK] Seq=1 Ack=57473 Win=145152 Len=0 TSval=505575766 TSecr=3166213036
    170 80.797832816   192.168.0.3           192.168.0.18          TCP      66     1234 → 44928 [ACK] Seq=1 Ack=58921 Win=147968 Len=0 TSval=505575766 TSecr=3166213036
    171 80.797847407   192.168.0.3           192.168.0.18          TCP      66     1234 → 44928 [ACK] Seq=1 Ack=60369 Win=150912 Len=0 TSval=505575766 TSecr=3166213036
    172 80.798015913   192.168.0.18          192.168.0.3           TCP      1514   44928 → 1234 [ACK] Seq=92273 Ack=1 Win=29312 Len=1448 TSval=3166213036 TSecr=505575640
    173 80.798022096   192.168.0.18          192.168.0.3           TCP      1514   44928 → 1234 [ACK] Seq=93721 Ack=1 Win=29312 Len=1448 TSval=3166213036 TSecr=505575640
    174 80.798262277   192.168.0.3           192.168.0.18          TCP      66     1234 → 44928 [ACK] Seq=1 Ack=61817 Win=153728 Len=0 TSval=505575766 TSecr=3166213036
    175 80.798279593   192.168.0.18          192.168.0.3           TCP      1514   44928 → 1234 [ACK] Seq=95169 Ack=1 Win=29312 Len=1448 TSval=3166213036 TSecr=505575640
    176 80.798285529   192.168.0.18          192.168.0.3           TCP      1514   44928 → 1234 [ACK] Seq=96617 Ack=1 Win=29312 Len=1448 TSval=3166213036 TSecr=505575640
    177 80.798291967   192.168.0.3           192.168.0.18          TCP      66     1234 → 44928 [ACK] Seq=1 Ack=63265 Win=156672 Len=0 TSval=505575766 TSecr=3166213036
    178 80.798513360   192.168.0.3           192.168.0.18          TCP      66     1234 → 44928 [ACK] Seq=1 Ack=64713 Win=159616 Len=0 TSval=505575766 TSecr=3166213036
    179 80.798530813   192.168.0.18          192.168.0.3           TCP      1514   44928 → 1234 [ACK] Seq=98065 Ack=1 Win=29312 Len=1448 TSval=3166213036 TSecr=505575640
    180 80.798536411   192.168.0.18          192.168.0.3           TCP      1514   44928 → 1234 [ACK] Seq=99513 Ack=1 Win=29312 Len=1448 TSval=3166213036 TSecr=505575640
    181 80.798542257   192.168.0.3           192.168.0.18          TCP      66     1234 → 44928 [ACK] Seq=1 Ack=66161 Win=162432 Len=0 TSval=505575766 TSecr=3166213036
    182 80.798557406   192.168.0.3           192.168.0.18          TCP      66     1234 → 44928 [ACK] Seq=1 Ack=67609 Win=165376 Len=0 TSval=505575766 TSecr=3166213036
    183 80.798761774   192.168.0.18          192.168.0.3           TCP      1514   44928 → 1234 [ACK] Seq=100961 Ack=1 Win=29312 Len=1448 TSval=3166213036 TSecr=505575640
    184 80.798767981   192.168.0.18          192.168.0.3           TCP      1514   44928 → 1234 [ACK] Seq=102409 Ack=1 Win=29312 Len=1448 TSval=3166213036 TSecr=505575640
    185 80.799260911   192.168.0.3           192.168.0.18          TCP      66     1234 → 44928 [ACK] Seq=1 Ack=69057 Win=168320 Len=0 TSval=505575766 TSecr=3166213036
    186 80.799280594   192.168.0.3           192.168.0.18          TCP      66     1234 → 44928 [ACK] Seq=1 Ack=70505 Win=171136 Len=0 TSval=505575766 TSecr=3166213036
    187 80.799296319   192.168.0.3           192.168.0.18          TCP      66     1234 → 44928 [ACK] Seq=1 Ack=71953 Win=174080 Len=0 TSval=505575766 TSecr=3166213036
    188 80.799310508   192.168.0.3           192.168.0.18          TCP      66     1234 → 44928 [ACK] Seq=1 Ack=72001 Win=174080 Len=0 TSval=505575766 TSecr=3166213036
    189 80.799324948   192.168.0.3           192.168.0.18          TCP      66     1234 → 44928 [ACK] Seq=1 Ack=73449 Win=176896 Len=0 TSval=505575766 TSecr=3166213036
    190 80.799340214   192.168.0.3           192.168.0.18          TCP      66     1234 → 44928 [ACK] Seq=1 Ack=74897 Win=179840 Len=0 TSval=505575766 TSecr=3166213036
    191 80.799761244   192.168.0.3           192.168.0.18          TCP      66     1234 → 44928 [ACK] Seq=1 Ack=76345 Win=182784 Len=0 TSval=505575766 TSecr=3166213036
    192 80.799779798   192.168.0.3           192.168.0.18          TCP      66     1234 → 44928 [ACK] Seq=1 Ack=77793 Win=185600 Len=0 TSval=505575766 TSecr=3166213036
    193 80.799795161   192.168.0.3           192.168.0.18          TCP      66     1234 → 44928 [ACK] Seq=1 Ack=79241 Win=185856 Len=0 TSval=505575766 TSecr=3166213036
    194 80.799808618   192.168.0.3           192.168.0.18          TCP      66     1234 → 44928 [ACK] Seq=1 Ack=80689 Win=185856 Len=0 TSval=505575766 TSecr=3166213036
    195 80.799823108   192.168.0.3           192.168.0.18          TCP      66     1234 → 44928 [ACK] Seq=1 Ack=82137 Win=185856 Len=0 TSval=505575766 TSecr=3166213036
    196 80.799835157   192.168.0.3           192.168.0.18          TCP      66     1234 → 44928 [ACK] Seq=1 Ack=83585 Win=185856 Len=0 TSval=505575766 TSecr=3166213036
    197 80.800629857   192.168.0.3           192.168.0.18          TCP      66     1234 → 44928 [ACK] Seq=1 Ack=85033 Win=185856 Len=0 TSval=505575766 TSecr=3166213036
    198 80.800648962   192.168.0.3           192.168.0.18          TCP      66     1234 → 44928 [ACK] Seq=1 Ack=86481 Win=185856 Len=0 TSval=505575766 TSecr=3166213036
    199 80.800663369   192.168.0.3           192.168.0.18          TCP      66     1234 → 44928 [ACK] Seq=1 Ack=87929 Win=185856 Len=0 TSval=505575766 TSecr=3166213036
    200 80.800677167   192.168.0.3           192.168.0.18          TCP      66     1234 → 44928 [ACK] Seq=1 Ack=89377 Win=185856 Len=0 TSval=505575766 TSecr=3166213036
    201 80.800690406   192.168.0.3           192.168.0.18          TCP      66     1234 → 44928 [ACK] Seq=1 Ack=90825 Win=185856 Len=0 TSval=505575767 TSecr=3166213036
    202 80.800703198   192.168.0.3           192.168.0.18          TCP      66     1234 → 44928 [ACK] Seq=1 Ack=92273 Win=185856 Len=0 TSval=505575767 TSecr=3166213036
    203 80.801968796   192.168.0.3           192.168.0.18          TCP      66     1234 → 44928 [ACK] Seq=1 Ack=93721 Win=185856 Len=0 TSval=505575767 TSecr=3166213036
    204 80.801987028   192.168.0.3           192.168.0.18          TCP      66     1234 → 44928 [ACK] Seq=1 Ack=95169 Win=185856 Len=0 TSval=505575767 TSecr=3166213036
    205 80.802001157   192.168.0.3           192.168.0.18          TCP      66     1234 → 44928 [ACK] Seq=1 Ack=96617 Win=185856 Len=0 TSval=505575767 TSecr=3166213036
    206 80.802015186   192.168.0.3           192.168.0.18          TCP      66     1234 → 44928 [ACK] Seq=1 Ack=98065 Win=185856 Len=0 TSval=505575767 TSecr=3166213036
    207 80.802028716   192.168.0.3           192.168.0.18          TCP      66     1234 → 44928 [ACK] Seq=1 Ack=99513 Win=185856 Len=0 TSval=505575767 TSecr=3166213036
    208 80.803144673   192.168.0.3           192.168.0.18          TCP      66     1234 → 44928 [ACK] Seq=1 Ack=102409 Win=185856 Len=0 TSval=505575767 TSecr=3166213036
    209 80.845656133   192.168.0.3           192.168.0.18          TCP      66     1234 → 44928 [ACK] Seq=1 Ack=103857 Win=185856 Len=0 TSval=505575778 TSecr=3166213036
    210 81.296626138   192.168.0.18          192.168.0.3           TCP      1514   44928 → 1234 [ACK] Seq=103857 Ack=1 Win=29312 Len=1448 TSval=3166213162 TSecr=505575765
    211 81.296640300   192.168.0.18          192.168.0.3           TCP      1514   44928 → 1234 [ACK] Seq=105305 Ack=1 Win=29312 Len=1448 TSval=3166213162 TSecr=505575765
    212 81.296655413   192.168.0.18          192.168.0.3           TCP      1514   44928 → 1234 [ACK] Seq=106753 Ack=1 Win=29312 Len=1448 TSval=3166213162 TSecr=505575765
    213 81.296658355   192.168.0.18          192.168.0.3           TCP      1514   44928 → 1234 [ACK] Seq=108201 Ack=1 Win=29312 Len=1448 TSval=3166213162 TSecr=505575765
    214 81.296660215   192.168.0.18          192.168.0.3           TCP      1514   44928 → 1234 [ACK] Seq=109649 Ack=1 Win=29312 Len=1448 TSval=3166213162 TSecr=505575766
    215 81.296662358   192.168.0.18          192.168.0.3           TCP      1514   44928 → 1234 [ACK] Seq=111097 Ack=1 Win=29312 Len=1448 TSval=3166213162 TSecr=505575766
    216 81.296663766   192.168.0.18          192.168.0.3           TCP      1514   44928 → 1234 [ACK] Seq=112545 Ack=1 Win=29312 Len=1448 TSval=3166213162 TSecr=505575766
    217 81.296665097   192.168.0.18          192.168.0.3           TCP      1514   44928 → 1234 [ACK] Seq=113993 Ack=1 Win=29312 Len=1448 TSval=3166213162 TSecr=505575766
    218 81.297117589   192.168.0.18          192.168.0.3           TCP      1514   44928 → 1234 [ACK] Seq=115441 Ack=1 Win=29312 Len=1448 TSval=3166213162 TSecr=505575766
    219 81.297126722   192.168.0.18          192.168.0.3           TCP      1514   44928 → 1234 [ACK] Seq=116889 Ack=1 Win=29312 Len=1448 TSval=3166213162 TSecr=505575766
    220 81.297156224   192.168.0.18          192.168.0.3           TCP      1514   44928 → 1234 [ACK] Seq=118337 Ack=1 Win=29312 Len=1448 TSval=3166213162 TSecr=505575766
    221 81.297158933   192.168.0.18          192.168.0.3           TCP      1514   44928 → 1234 [ACK] Seq=119785 Ack=1 Win=29312 Len=1448 TSval=3166213162 TSecr=505575766
    222 81.297165845   192.168.0.18          192.168.0.3           TCP      1514   44928 → 1234 [ACK] Seq=121233 Ack=1 Win=29312 Len=1448 TSval=3166213162 TSecr=505575766
    223 81.297167494   192.168.0.18          192.168.0.3           TCP      1514   44928 → 1234 [ACK] Seq=122681 Ack=1 Win=29312 Len=1448 TSval=3166213162 TSecr=505575766
    224 81.297808995   192.168.0.18          192.168.0.3           TCP      1514   44928 → 1234 [ACK] Seq=124129 Ack=1 Win=29312 Len=1448 TSval=3166213162 TSecr=505575766
    225 81.297817211   192.168.0.18          192.168.0.3           TCP      1514   44928 → 1234 [ACK] Seq=125577 Ack=1 Win=29312 Len=1448 TSval=3166213162 TSecr=505575766
    226 81.297835711   192.168.0.18          192.168.0.3           TCP      1514   44928 → 1234 [ACK] Seq=127025 Ack=1 Win=29312 Len=1448 TSval=3166213162 TSecr=505575766
    227 81.297837584   192.168.0.18          192.168.0.3           TCP      1514   44928 → 1234 [ACK] Seq=128473 Ack=1 Win=29312 Len=1448 TSval=3166213162 TSecr=505575766
    228 81.297850743   192.168.0.18          192.168.0.3           TCP      1514   44928 → 1234 [ACK] Seq=129921 Ack=1 Win=29312 Len=1448 TSval=3166213162 TSecr=505575766
    229 81.297853910   192.168.0.18          192.168.0.3           TCP      1514   44928 → 1234 [ACK] Seq=131369 Ack=1 Win=29312 Len=1448 TSval=3166213162 TSecr=505575766
    230 81.298134348   192.168.0.18          192.168.0.3           TCP      1514   44928 → 1234 [ACK] Seq=132817 Ack=1 Win=29312 Len=1448 TSval=3166213162 TSecr=505575766
    231 81.298142488   192.168.0.18          192.168.0.3           TCP      1514   44928 → 1234 [ACK] Seq=134265 Ack=1 Win=29312 Len=1448 TSval=3166213162 TSecr=505575766
    232 81.298383943   192.168.0.18          192.168.0.3           TCP      1514   44928 → 1234 [ACK] Seq=135713 Ack=1 Win=29312 Len=1448 TSval=3166213162 TSecr=505575766
    233 81.298392310   192.168.0.18          192.168.0.3           TCP      1514   44928 → 1234 [ACK] Seq=137161 Ack=1 Win=29312 Len=1448 TSval=3166213162 TSecr=505575766
    234 81.298631588   192.168.0.18          192.168.0.3           TCP      1514   44928 → 1234 [ACK] Seq=138609 Ack=1 Win=29312 Len=1448 TSval=3166213162 TSecr=505575766
    235 81.298639979   192.168.0.18          192.168.0.3           TCP      1514   44928 → 1234 [ACK] Seq=140057 Ack=1 Win=29312 Len=1448 TSval=3166213162 TSecr=505575766
    236 81.298869368   192.168.0.3           192.168.0.18          TCP      66     1234 → 44928 [ACK] Seq=1 Ack=106753 Win=185856 Len=0 TSval=505575891 TSecr=3166213162
    237 81.298922617   192.168.0.18          192.168.0.3           TCP      1514   44928 → 1234 [ACK] Seq=141505 Ack=1 Win=29312 Len=1448 TSval=3166213162 TSecr=505575766
    238 81.298928861   192.168.0.18          192.168.0.3           TCP      1514   44928 → 1234 [ACK] Seq=142953 Ack=1 Win=29312 Len=1448 TSval=3166213162 TSecr=505575766
    239 81.298944234   192.168.0.3           192.168.0.18          TCP      66     1234 → 44928 [ACK] Seq=1 Ack=109649 Win=185856 Len=0 TSval=505575891 TSecr=3166213162
    240 81.298962590   192.168.0.3           192.168.0.18          TCP      66     1234 → 44928 [ACK] Seq=1 Ack=112545 Win=185856 Len=0 TSval=505575891 TSecr=3166213162
    241 81.299159344   192.168.0.18          192.168.0.3           TCP      1514   44928 → 1234 [ACK] Seq=144401 Ack=1 Win=29312 Len=1448 TSval=3166213162 TSecr=505575766
    242 81.299168818   192.168.0.18          192.168.0.3           TCP      1514   44928 → 1234 [ACK] Seq=145849 Ack=1 Win=29312 Len=1448 TSval=3166213162 TSecr=505575766
    243 81.299171366   192.168.0.18          192.168.0.3           TCP      1514   44928 → 1234 [ACK] Seq=147297 Ack=1 Win=29312 Len=1448 TSval=3166213162 TSecr=505575766
    244 81.299386014   192.168.0.18          192.168.0.3           TCP      1514   44928 → 1234 [ACK] Seq=148745 Ack=1 Win=29312 Len=1448 TSval=3166213162 TSecr=505575766
    245 81.299403367   192.168.0.18          192.168.0.3           TCP      1514   44928 → 1234 [ACK] Seq=150193 Ack=1 Win=29312 Len=1448 TSval=3166213162 TSecr=505575766
    246 81.299614979   192.168.0.3           192.168.0.18          TCP      66     1234 → 44928 [ACK] Seq=1 Ack=115441 Win=185856 Len=0 TSval=505575891 TSecr=3166213162
    247 81.299648381   192.168.0.18          192.168.0.3           TCP      1514   44928 → 1234 [ACK] Seq=151641 Ack=1 Win=29312 Len=1448 TSval=3166213162 TSecr=505575766
    248 81.299665733   192.168.0.3           192.168.0.18          TCP      66     1234 → 44928 [ACK] Seq=1 Ack=118337 Win=185856 Len=0 TSval=505575891 TSecr=3166213162
    249 81.299682909   192.168.0.3           192.168.0.18          TCP      66     1234 → 44928 [ACK] Seq=1 Ack=119785 Win=188672 Len=0 TSval=505575891 TSecr=3166213162
    250 81.299696336   192.168.0.3           192.168.0.18          TCP      66     1234 → 44928 [ACK] Seq=1 Ack=121233 Win=191616 Len=0 TSval=505575891 TSecr=3166213162
    251 81.299878827   192.168.0.18          192.168.0.3           TCP      1514   44928 → 1234 [ACK] Seq=153089 Ack=1 Win=29312 Len=1448 TSval=3166213162 TSecr=505575766
    252 81.299884164   192.168.0.18          192.168.0.3           TCP      1514   44928 → 1234 [ACK] Seq=154537 Ack=1 Win=29312 Len=1448 TSval=3166213162 TSecr=505575766
    253 81.300082463   192.168.0.18          192.168.0.3           TCP      1514   44928 → 1234 [ACK] Seq=155985 Ack=1 Win=29312 Len=1448 TSval=3166213162 TSecr=505575766
    254 81.300085958   192.168.0.18          192.168.0.3           TCP      1514   44928 → 1234 [ACK] Seq=157433 Ack=1 Win=29312 Len=1448 TSval=3166213162 TSecr=505575766
    255 81.300327209   192.168.0.3           192.168.0.18          TCP      66     1234 → 44928 [ACK] Seq=1 Ack=122681 Win=194432 Len=0 TSval=505575891 TSecr=3166213162
    256 81.300347063   192.168.0.18          192.168.0.3           TCP      1514   44928 → 1234 [ACK] Seq=158881 Ack=1 Win=29312 Len=1448 TSval=3166213162 TSecr=505575766
    257 81.300350487   192.168.0.18          192.168.0.3           TCP      1514   44928 → 1234 [ACK] Seq=160329 Ack=1 Win=29312 Len=1448 TSval=3166213162 TSecr=505575766
    258 81.300356530   192.168.0.3           192.168.0.18          TCP      66     1234 → 44928 [ACK] Seq=1 Ack=124129 Win=197376 Len=0 TSval=505575891 TSecr=3166213162
    259 81.300370121   192.168.0.3           192.168.0.18          TCP      66     1234 → 44928 [ACK] Seq=1 Ack=125577 Win=200320 Len=0 TSval=505575891 TSecr=3166213162
    260 81.300381695   192.168.0.3           192.168.0.18          TCP      66     1234 → 44928 [ACK] Seq=1 Ack=127025 Win=203136 Len=0 TSval=505575891 TSecr=3166213162
    261 81.300394075   192.168.0.3           192.168.0.18          TCP      66     1234 → 44928 [ACK] Seq=1 Ack=128473 Win=206080 Len=0 TSval=505575891 TSecr=3166213162
    262 81.300584880   192.168.0.18          192.168.0.3           TCP      1514   44928 → 1234 [ACK] Seq=161777 Ack=1 Win=29312 Len=1448 TSval=3166213162 TSecr=505575766
    263 81.300590495   192.168.0.18          192.168.0.3           TCP      1514   44928 → 1234 [ACK] Seq=163225 Ack=1 Win=29312 Len=1448 TSval=3166213162 TSecr=505575766
    264 81.300874059   192.168.0.18          192.168.0.3           TCP      1514   44928 → 1234 [ACK] Seq=164673 Ack=1 Win=29312 Len=1448 TSval=3166213162 TSecr=505575766
    265 81.300878735   192.168.0.18          192.168.0.3           TCP      1514   44928 → 1234 [ACK] Seq=166121 Ack=1 Win=29312 Len=1448 TSval=3166213162 TSecr=505575766
    266 81.300880524   192.168.0.18          192.168.0.3           TCP      1514   44928 → 1234 [ACK] Seq=167569 Ack=1 Win=29312 Len=1448 TSval=3166213162 TSecr=505575766
    267 81.301118775   192.168.0.3           192.168.0.18          TCP      66     1234 → 44928 [ACK] Seq=1 Ack=129921 Win=209024 Len=0 TSval=505575891 TSecr=3166213162
    268 81.301134409   192.168.0.18          192.168.0.3           TCP      1514   44928 → 1234 [ACK] Seq=169017 Ack=1 Win=29312 Len=1448 TSval=3166213162 TSecr=505575766
    269 81.301143321   192.168.0.18          192.168.0.3           TCP      1514   44928 → 1234 [ACK] Seq=170465 Ack=1 Win=29312 Len=1448 TSval=3166213162 TSecr=505575766
    270 81.301149491   192.168.0.3           192.168.0.18          TCP      66     1234 → 44928 [ACK] Seq=1 Ack=131369 Win=211840 Len=0 TSval=505575892 TSecr=3166213162
    271 81.301165670   192.168.0.3           192.168.0.18          TCP      66     1234 → 44928 [ACK] Seq=1 Ack=132817 Win=214784 Len=0 TSval=505575892 TSecr=3166213162
    272 81.301185792   192.168.0.3           192.168.0.18          TCP      66     1234 → 44928 [ACK] Seq=1 Ack=134265 Win=217600 Len=0 TSval=505575892 TSecr=3166213162
    273 81.301199122   192.168.0.3           192.168.0.18          TCP      66     1234 → 44928 [ACK] Seq=1 Ack=135713 Win=220544 Len=0 TSval=505575892 TSecr=3166213162
    274 81.301211475   192.168.0.3           192.168.0.18          TCP      66     1234 → 44928 [ACK] Seq=1 Ack=137161 Win=223488 Len=0 TSval=505575892 TSecr=3166213162
    275 81.301364203   192.168.0.18          192.168.0.3           TCP      1514   44928 → 1234 [ACK] Seq=171913 Ack=1 Win=29312 Len=1448 TSval=3166213162 TSecr=505575766
    276 81.301379613   192.168.0.18          192.168.0.3           TCP      1514   44928 → 1234 [ACK] Seq=173361 Ack=1 Win=29312 Len=1448 TSval=3166213162 TSecr=505575766
    277 81.301615550   192.168.0.18          192.168.0.3           TCP      1514   44928 → 1234 [ACK] Seq=174809 Ack=1 Win=29312 Len=1448 TSval=3166213162 TSecr=505575766
    278 81.301624516   192.168.0.18          192.168.0.3           TCP      1514   44928 → 1234 [ACK] Seq=176257 Ack=1 Win=29312 Len=1448 TSval=3166213162 TSecr=505575766
    279 81.301845528   192.168.0.3           192.168.0.18          TCP      66     1234 → 44928 [ACK] Seq=1 Ack=140057 Win=229248 Len=0 TSval=505575892 TSecr=3166213162
    280 81.301862607   192.168.0.18          192.168.0.3           TCP      1514   44928 → 1234 [ACK] Seq=177705 Ack=1 Win=29312 Len=1448 TSval=3166213162 TSecr=505575766
    281 81.301874121   192.168.0.3           192.168.0.18          TCP      66     1234 → 44928 [ACK] Seq=1 Ack=141505 Win=232192 Len=0 TSval=505575892 TSecr=3166213162
    282 81.301888782   192.168.0.3           192.168.0.18          TCP      66     1234 → 44928 [ACK] Seq=1 Ack=142953 Win=235008 Len=0 TSval=505575892 TSecr=3166213162
    283 81.301897223   192.168.0.3           192.168.0.18          TCP      66     1234 → 44928 [ACK] Seq=1 Ack=144401 Win=237952 Len=0 TSval=505575892 TSecr=3166213162
    284 81.301903336   192.168.0.3           192.168.0.18          TCP      66     1234 → 44928 [ACK] Seq=1 Ack=145849 Win=240768 Len=0 TSval=505575892 TSecr=3166213162
    285 81.301909278   192.168.0.3           192.168.0.18          TCP      66     1234 → 44928 [ACK] Seq=1 Ack=147297 Win=243712 Len=0 TSval=505575892 TSecr=3166213162
    286 81.302120689   192.168.0.18          192.168.0.3           TCP      1514   44928 → 1234 [ACK] Seq=179153 Ack=1 Win=29312 Len=1448 TSval=3166213162 TSecr=505575766
    287 81.302125495   192.168.0.18          192.168.0.3           TCP      1514   44928 → 1234 [ACK] Seq=180601 Ack=1 Win=29312 Len=1448 TSval=3166213162 TSecr=505575766
    288 81.302127100   192.168.0.18          192.168.0.3           TCP      1514   44928 → 1234 [ACK] Seq=182049 Ack=1 Win=29312 Len=1448 TSval=3166213162 TSecr=505575766
    289 81.302361272   192.168.0.18          192.168.0.3           TCP      1514   44928 → 1234 [ACK] Seq=183497 Ack=1 Win=29312 Len=1448 TSval=3166213162 TSecr=505575766
    290 81.302369351   192.168.0.18          192.168.0.3           TCP      1514   44928 → 1234 [ACK] Seq=184945 Ack=1 Win=29312 Len=1448 TSval=3166213163 TSecr=505575766
    291 81.302590250   192.168.0.3           192.168.0.18          TCP      66     1234 → 44928 [ACK] Seq=1 Ack=148745 Win=246656 Len=0 TSval=505575892 TSecr=3166213162
    292 81.302600851   192.168.0.3           192.168.0.18          TCP      66     1234 → 44928 [ACK] Seq=1 Ack=150193 Win=249472 Len=0 TSval=505575892 TSecr=3166213162
    293 81.302606666   192.168.0.3           192.168.0.18          TCP      66     1234 → 44928 [ACK] Seq=1 Ack=151641 Win=252416 Len=0 TSval=505575892 TSecr=3166213162
    294 81.302611759   192.168.0.3           192.168.0.18          TCP      66     1234 → 44928 [ACK] Seq=1 Ack=153089 Win=255360 Len=0 TSval=505575892 TSecr=3166213162
    295 81.302616672   192.168.0.3           192.168.0.18          TCP      66     1234 → 44928 [ACK] Seq=1 Ack=154537 Win=258176 Len=0 TSval=505575892 TSecr=3166213162
    296 81.302621615   192.168.0.3           192.168.0.18          TCP      66     1234 → 44928 [ACK] Seq=1 Ack=155985 Win=261120 Len=0 TSval=505575892 TSecr=3166213162
    297 81.302631777   192.168.0.18          192.168.0.3           TCP      1514   44928 → 1234 [ACK] Seq=186393 Ack=1 Win=29312 Len=1448 TSval=3166213163 TSecr=505575766
    298 81.302638573   192.168.0.18          192.168.0.3           TCP      1514   44928 → 1234 [ACK] Seq=187841 Ack=1 Win=29312 Len=1448 TSval=3166213163 TSecr=505575766
    299 81.302861839   192.168.0.18          192.168.0.3           TCP      1514   44928 → 1234 [ACK] Seq=189289 Ack=1 Win=29312 Len=1448 TSval=3166213163 TSecr=505575766
    300 81.302871116   192.168.0.18          192.168.0.3           TCP      1514   44928 → 1234 [ACK] Seq=190737 Ack=1 Win=29312 Len=1448 TSval=3166213163 TSecr=505575766
    301 81.303109294   192.168.0.18          192.168.0.3           TCP      1514   44928 → 1234 [ACK] Seq=192185 Ack=1 Win=29312 Len=1448 TSval=3166213163 TSecr=505575766
    302 81.303117631   192.168.0.18          192.168.0.3           TCP      1514   44928 → 1234 [ACK] Seq=193633 Ack=1 Win=29312 Len=1448 TSval=3166213163 TSecr=505575766
    303 81.303362159   192.168.0.3           192.168.0.18          TCP      66     1234 → 44928 [ACK] Seq=1 Ack=157433 Win=263936 Len=0 TSval=505575892 TSecr=3166213162
    304 81.303372854   192.168.0.3           192.168.0.18          TCP      66     1234 → 44928 [ACK] Seq=1 Ack=158881 Win=266880 Len=0 TSval=505575892 TSecr=3166213162
    305 81.303378305   192.168.0.3           192.168.0.18          TCP      66     1234 → 44928 [ACK] Seq=1 Ack=160329 Win=269824 Len=0 TSval=505575892 TSecr=3166213162
    306 81.303383656   192.168.0.3           192.168.0.18          TCP      66     1234 → 44928 [ACK] Seq=1 Ack=161777 Win=272640 Len=0 TSval=505575892 TSecr=3166213162
    307 81.303389535   192.168.0.3           192.168.0.18          TCP      66     1234 → 44928 [ACK] Seq=1 Ack=163225 Win=275584 Len=0 TSval=505575892 TSecr=3166213162
    308 81.303395119   192.168.0.3           192.168.0.18          TCP      66     1234 → 44928 [ACK] Seq=1 Ack=164673 Win=278528 Len=0 TSval=505575892 TSecr=3166213162
    309 81.303405844   192.168.0.18          192.168.0.3           TCP      1514   44928 → 1234 [ACK] Seq=195081 Ack=1 Win=29312 Len=1448 TSval=3166213163 TSecr=505575766
    310 81.303413944   192.168.0.18          192.168.0.3           TCP      1514   44928 → 1234 [ACK] Seq=196529 Ack=1 Win=29312 Len=1448 TSval=3166213163 TSecr=505575767
    311 81.303570607   192.168.0.18          192.168.0.3           TCP      1514   44928 → 1234 [ACK] Seq=197977 Ack=1 Win=29312 Len=1448 TSval=3166213163 TSecr=505575767
    312 81.303823169   192.168.0.18          192.168.0.3           TCP      1514   44928 → 1234 [ACK] Seq=199425 Ack=1 Win=29312 Len=1448 TSval=3166213163 TSecr=505575767
    313 81.303825864   192.168.0.18          192.168.0.3           TCP      1514   44928 → 1234 [ACK] Seq=200873 Ack=1 Win=29312 Len=1448 TSval=3166213163 TSecr=505575767
    314 81.304068824   192.168.0.3           192.168.0.18          TCP      66     1234 → 44928 [ACK] Seq=1 Ack=166121 Win=281344 Len=0 TSval=505575892 TSecr=3166213162
    315 81.304079248   192.168.0.3           192.168.0.18          TCP      66     1234 → 44928 [ACK] Seq=1 Ack=167569 Win=284288 Len=0 TSval=505575892 TSecr=3166213162
    316 81.304084568   192.168.0.3           192.168.0.18          TCP      66     1234 → 44928 [ACK] Seq=1 Ack=169017 Win=287104 Len=0 TSval=505575892 TSecr=3166213162
    317 81.304089612   192.168.0.3           192.168.0.18          TCP      66     1234 → 44928 [ACK] Seq=1 Ack=170465 Win=290048 Len=0 TSval=505575892 TSecr=3166213162
    318 81.304094333   192.168.0.3           192.168.0.18          TCP      66     1234 → 44928 [ACK] Seq=1 Ack=171913 Win=292992 Len=0 TSval=505575892 TSecr=3166213162
    319 81.304098604   192.168.0.3           192.168.0.18          TCP      66     1234 → 44928 [ACK] Seq=1 Ack=173361 Win=295808 Len=0 TSval=505575892 TSecr=3166213162
    320 81.304113609   192.168.0.18          192.168.0.3           TCP      1514   44928 → 1234 [ACK] Seq=202321 Ack=1 Win=29312 Len=1448 TSval=3166213163 TSecr=505575767
    321 81.304116358   192.168.0.18          192.168.0.3           TCP      1514   44928 → 1234 [ACK] Seq=203769 Ack=1 Win=29312 Len=1448 TSval=3166213163 TSecr=505575767
    322 81.304117873   192.168.0.18          192.168.0.3           TCP      1514   44928 → 1234 [ACK] Seq=205217 Ack=1 Win=29312 Len=1448 TSval=3166213163 TSecr=505575767
    323 81.304318984   192.168.0.18          192.168.0.3           TCP      1514   44928 → 1234 [ACK] Seq=206665 Ack=1 Win=29312 Len=1448 TSval=3166213163 TSecr=505575767
    324 81.304324796   192.168.0.18          192.168.0.3           TCP      1514   44928 → 1234 [ACK] Seq=208113 Ack=1 Win=29312 Len=1448 TSval=3166213163 TSecr=505575767
    325 81.304570074   192.168.0.18          192.168.0.3           TCP      1514   44928 → 1234 [ACK] Seq=209561 Ack=1 Win=29312 Len=1448 TSval=3166213163 TSecr=505575767
    326 81.304575301   192.168.0.18          192.168.0.3           TCP      1514   44928 → 1234 [ACK] Seq=211009 Ack=1 Win=29312 Len=1448 TSval=3166213163 TSecr=505575767
    327 81.304853682   192.168.0.3           192.168.0.18          TCP      66     1234 → 44928 [ACK] Seq=1 Ack=174809 Win=298752 Len=0 TSval=505575892 TSecr=3166213162
    328 81.304864290   192.168.0.3           192.168.0.18          TCP      66     1234 → 44928 [ACK] Seq=1 Ack=176257 Win=301696 Len=0 TSval=505575892 TSecr=3166213162
    329 81.304870035   192.168.0.3           192.168.0.18          TCP      66     1234 → 44928 [ACK] Seq=1 Ack=177705 Win=304512 Len=0 TSval=505575893 TSecr=3166213162
    330 81.304875466   192.168.0.3           192.168.0.18          TCP      66     1234 → 44928 [ACK] Seq=1 Ack=179153 Win=307456 Len=0 TSval=505575893 TSecr=3166213162
    331 81.304880278   192.168.0.3           192.168.0.18          TCP      66     1234 → 44928 [ACK] Seq=1 Ack=180601 Win=310272 Len=0 TSval=505575893 TSecr=3166213162
    332 81.304884973   192.168.0.3           192.168.0.18          TCP      66     1234 → 44928 [ACK] Seq=1 Ack=182049 Win=313216 Len=0 TSval=505575893 TSecr=3166213162
    333 81.304895885   192.168.0.18          192.168.0.3           TCP      1514   44928 → 1234 [ACK] Seq=212457 Ack=1 Win=29312 Len=1448 TSval=3166213163 TSecr=505575767
    334 81.304904289   192.168.0.18          192.168.0.3           TCP      1514   44928 → 1234 [ACK] Seq=213905 Ack=1 Win=29312 Len=1448 TSval=3166213163 TSecr=505575767
    335 81.305078329   192.168.0.18          192.168.0.3           TCP      1514   44928 → 1234 [ACK] Seq=215353 Ack=1 Win=29312 Len=1448 TSval=3166213163 TSecr=505575767
    336 81.305088673   192.168.0.18          192.168.0.3           TCP      1514   44928 → 1234 [ACK] Seq=216801 Ack=1 Win=29312 Len=1448 TSval=3166213163 TSecr=505575767
    337 81.305347033   192.168.0.18          192.168.0.3           TCP      1514   44928 → 1234 [ACK] Seq=218249 Ack=1 Win=29312 Len=1448 TSval=3166213163 TSecr=505575767
    338 81.305355286   192.168.0.18          192.168.0.3           TCP      1514   44928 → 1234 [ACK] Seq=219697 Ack=1 Win=29312 Len=1448 TSval=3166213163 TSecr=505575767
    339 81.305592254   192.168.0.3           192.168.0.18          TCP      66     1234 → 44928 [ACK] Seq=1 Ack=183497 Win=316160 Len=0 TSval=505575893 TSecr=3166213162
    340 81.305604717   192.168.0.3           192.168.0.18          TCP      66     1234 → 44928 [ACK] Seq=1 Ack=184945 Win=318976 Len=0 TSval=505575893 TSecr=3166213162
    341 81.305610429   192.168.0.3           192.168.0.18          TCP      66     1234 → 44928 [ACK] Seq=1 Ack=186393 Win=321920 Len=0 TSval=505575893 TSecr=3166213163
    342 81.305615730   192.168.0.3           192.168.0.18          TCP      66     1234 → 44928 [ACK] Seq=1 Ack=187841 Win=324864 Len=0 TSval=505575893 TSecr=3166213163
    343 81.305620980   192.168.0.3           192.168.0.18          TCP      66     1234 → 44928 [ACK] Seq=1 Ack=189289 Win=327680 Len=0 TSval=505575893 TSecr=3166213163
    344 81.305625752   192.168.0.3           192.168.0.18          TCP      66     1234 → 44928 [ACK] Seq=1 Ack=190737 Win=330624 Len=0 TSval=505575893 TSecr=3166213163
    345 81.305636129   192.168.0.18          192.168.0.3           TCP      1514   44928 → 1234 [ACK] Seq=221145 Ack=1 Win=29312 Len=1448 TSval=3166213163 TSecr=505575767
    346 81.306854237   192.168.0.3           192.168.0.18          TCP      66     1234 → 44928 [ACK] Seq=1 Ack=192185 Win=333440 Len=0 TSval=505575893 TSecr=3166213163
    347 81.306864677   192.168.0.3           192.168.0.18          TCP      66     1234 → 44928 [ACK] Seq=1 Ack=193633 Win=336128 Len=0 TSval=505575893 TSecr=3166213163
    348 81.306870399   192.168.0.3           192.168.0.18          TCP      66     1234 → 44928 [ACK] Seq=1 Ack=196529 Win=336128 Len=0 TSval=505575893 TSecr=3166213163
    349 81.306876017   192.168.0.3           192.168.0.18          TCP      66     1234 → 44928 [ACK] Seq=1 Ack=199425 Win=336128 Len=0 TSval=505575893 TSecr=3166213163
    350 81.306882485   192.168.0.3           192.168.0.18          TCP      66     1234 → 44928 [ACK] Seq=1 Ack=202321 Win=336128 Len=0 TSval=505575893 TSecr=3166213163
    351 81.306888344   192.168.0.3           192.168.0.18          TCP      66     1234 → 44928 [ACK] Seq=1 Ack=205217 Win=336128 Len=0 TSval=505575893 TSecr=3166213163
    352 81.308279094   192.168.0.3           192.168.0.18          TCP      66     1234 → 44928 [ACK] Seq=1 Ack=208113 Win=336128 Len=0 TSval=505575893 TSecr=3166213163
    353 81.308289825   192.168.0.3           192.168.0.18          TCP      66     1234 → 44928 [ACK] Seq=1 Ack=211009 Win=336128 Len=0 TSval=505575893 TSecr=3166213163
    354 81.308295390   192.168.0.3           192.168.0.18          TCP      66     1234 → 44928 [ACK] Seq=1 Ack=213905 Win=336128 Len=0 TSval=505575893 TSecr=3166213163
    355 81.309537733   192.168.0.3           192.168.0.18          TCP      66     1234 → 44928 [ACK] Seq=1 Ack=216801 Win=336128 Len=0 TSval=505575893 TSecr=3166213163
    356 81.309548187   192.168.0.3           192.168.0.18          TCP      66     1234 → 44928 [ACK] Seq=1 Ack=219697 Win=336128 Len=0 TSval=505575894 TSecr=3166213163
    357 81.309553534   192.168.0.3           192.168.0.18          TCP      66     1234 → 44928 [ACK] Seq=1 Ack=222593 Win=336128 Len=0 TSval=505575894 TSecr=3166213163
    358 81.345758858   192.168.0.18          192.168.0.3           TCP      1514   44928 → 1234 [ACK] Seq=222593 Ack=1 Win=29312 Len=1448 TSval=3166213174 TSecr=505575778
    359 81.345771876   192.168.0.18          192.168.0.3           TCP      1514   44928 → 1234 [ACK] Seq=224041 Ack=1 Win=29312 Len=1448 TSval=3166213174 TSecr=505575778
    360 81.349186212   192.168.0.3           192.168.0.18          TCP      66     1234 → 44928 [ACK] Seq=1 Ack=225489 Win=336128 Len=0 TSval=505575903 TSecr=3166213174
    361 81.798957586   192.168.0.18          192.168.0.3           TCP      1514   44928 → 1234 [ACK] Seq=225489 Ack=1 Win=29312 Len=1448 TSval=3166213287 TSecr=505575891
    362 81.798971093   192.168.0.18          192.168.0.3           TCP      1514   44928 → 1234 [ACK] Seq=226937 Ack=1 Win=29312 Len=1448 TSval=3166213287 TSecr=505575891
    363 81.798983546   192.168.0.18          192.168.0.3           TCP      1514   44928 → 1234 [ACK] Seq=228385 Ack=1 Win=29312 Len=1448 TSval=3166213287 TSecr=505575891
    364 81.798985472   192.168.0.18          192.168.0.3           TCP      1514   44928 → 1234 [ACK] Seq=229833 Ack=1 Win=29312 Len=1448 TSval=3166213287 TSecr=505575891
    365 81.798987529   192.168.0.18          192.168.0.3           TCP      1514   44928 → 1234 [ACK] Seq=231281 Ack=1 Win=29312 Len=1448 TSval=3166213287 TSecr=505575891
    366 81.798988817   192.168.0.18          192.168.0.3           TCP      1514   44928 → 1234 [ACK] Seq=232729 Ack=1 Win=29312 Len=1448 TSval=3166213287 TSecr=505575891
    367 81.798990021   192.168.0.18          192.168.0.3           TCP      1514   44928 → 1234 [ACK] Seq=234177 Ack=1 Win=29312 Len=1448 TSval=3166213287 TSecr=505575891
    368 81.798991435   192.168.0.18          192.168.0.3           TCP      1514   44928 → 1234 [ACK] Seq=235625 Ack=1 Win=29312 Len=1448 TSval=3166213287 TSecr=505575891
    369 81.799196947   192.168.0.18          192.168.0.3           TCP      1514   44928 → 1234 [ACK] Seq=237073 Ack=1 Win=29312 Len=1448 TSval=3166213287 TSecr=505575891
    370 81.799204806   192.168.0.18          192.168.0.3           TCP      1514   44928 → 1234 [ACK] Seq=238521 Ack=1 Win=29312 Len=1448 TSval=3166213287 TSecr=505575891
    371 81.799206615   192.168.0.18          192.168.0.3           TCP      1514   44928 → 1234 [ACK] Seq=239969 Ack=1 Win=29312 Len=1448 TSval=3166213287 TSecr=505575891
    372 81.799208157   192.168.0.18          192.168.0.3           TCP      1514   44928 → 1234 [ACK] Seq=241417 Ack=1 Win=29312 Len=1448 TSval=3166213287 TSecr=505575891
    373 81.799738565   192.168.0.18          192.168.0.3           TCP      1514   44928 → 1234 [ACK] Seq=242865 Ack=1 Win=29312 Len=1448 TSval=3166213287 TSecr=505575891
    374 81.799750483   192.168.0.18          192.168.0.3           TCP      1514   44928 → 1234 [ACK] Seq=244313 Ack=1 Win=29312 Len=1448 TSval=3166213287 TSecr=505575891
    375 81.799934746   192.168.0.18          192.168.0.3           TCP      1514   44928 → 1234 [ACK] Seq=245761 Ack=1 Win=29312 Len=1448 TSval=3166213287 TSecr=505575891
    376 81.799942686   192.168.0.18          192.168.0.3           TCP      1514   44928 → 1234 [ACK] Seq=247209 Ack=1 Win=29312 Len=1448 TSval=3166213287 TSecr=505575891
    377 81.800237085   192.168.0.18          192.168.0.3           TCP      1514   44928 → 1234 [ACK] Seq=248657 Ack=1 Win=29312 Len=1448 TSval=3166213287 TSecr=505575891
    378 81.800249582   192.168.0.18          192.168.0.3           TCP      1514   44928 → 1234 [ACK] Seq=250105 Ack=1 Win=29312 Len=1448 TSval=3166213287 TSecr=505575891
    379 81.800465619   192.168.0.18          192.168.0.3           TCP      1514   44928 → 1234 [ACK] Seq=251553 Ack=1 Win=29312 Len=1448 TSval=3166213287 TSecr=505575891
    380 81.800473601   192.168.0.18          192.168.0.3           TCP      1514   44928 → 1234 [ACK] Seq=253001 Ack=1 Win=29312 Len=1448 TSval=3166213287 TSecr=505575891
    381 81.800695881   192.168.0.3           192.168.0.18          TCP      66     1234 → 44928 [ACK] Seq=1 Ack=228385 Win=336128 Len=0 TSval=505576017 TSecr=3166213287
    382 81.800726634   192.168.0.3           192.168.0.18          TCP      66     1234 → 44928 [ACK] Seq=1 Ack=231281 Win=336128 Len=0 TSval=505576017 TSecr=3166213287
    383 81.800753347   192.168.0.18          192.168.0.3           TCP      1514   44928 → 1234 [ACK] Seq=254449 Ack=1 Win=29312 Len=1448 TSval=3166213287 TSecr=505575891
    384 81.800758547   192.168.0.18          192.168.0.3           TCP      1514   44928 → 1234 [ACK] Seq=255897 Ack=1 Win=29312 Len=1448 TSval=3166213287 TSecr=505575891
    385 81.800983472   192.168.0.18          192.168.0.3           TCP      1514   44928 → 1234 [ACK] Seq=257345 Ack=1 Win=29312 Len=1448 TSval=3166213287 TSecr=505575891
    386 81.800995177   192.168.0.18          192.168.0.3           TCP      1514   44928 → 1234 [ACK] Seq=258793 Ack=1 Win=29312 Len=1448 TSval=3166213287 TSecr=505575891
    387 81.801149236   192.168.0.18          192.168.0.3           TCP      1514   44928 → 1234 [ACK] Seq=260241 Ack=1 Win=29312 Len=1448 TSval=3166213287 TSecr=505575891
    388 81.801152891   192.168.0.18          192.168.0.3           TCP      1514   44928 → 1234 [ACK] Seq=261689 Ack=1 Win=29312 Len=1448 TSval=3166213287 TSecr=505575891
    389 81.801394961   192.168.0.18          192.168.0.3           TCP      1514   44928 → 1234 [ACK] Seq=263137 Ack=1 Win=29312 Len=1448 TSval=3166213287 TSecr=505575891
    390 81.801399453   192.168.0.18          192.168.0.3           TCP      1514   44928 → 1234 [ACK] Seq=264585 Ack=1 Win=29312 Len=1448 TSval=3166213287 TSecr=505575891
    391 81.801718559   192.168.0.3           192.168.0.18          TCP      66     1234 → 44928 [ACK] Seq=1 Ack=234177 Win=336128 Len=0 TSval=505576017 TSecr=3166213287
    392 81.801752997   192.168.0.3           192.168.0.18          TCP      66     1234 → 44928 [ACK] Seq=1 Ack=237073 Win=336128 Len=0 TSval=505576017 TSecr=3166213287
    393 81.801760695   192.168.0.3           192.168.0.18          TCP      66     1234 → 44928 [ACK] Seq=1 Ack=241417 Win=336128 Len=0 TSval=505576017 TSecr=3166213287
    394 81.801791545   192.168.0.18          192.168.0.3           TCP      1514   44928 → 1234 [ACK] Seq=266033 Ack=1 Win=29312 Len=1448 TSval=3166213287 TSecr=505575891
    395 81.801796816   192.168.0.18          192.168.0.3           TCP      1514   44928 → 1234 [ACK] Seq=267481 Ack=1 Win=29312 Len=1448 TSval=3166213287 TSecr=505575891
    396 81.801798722   192.168.0.18          192.168.0.3           TCP      1514   44928 → 1234 [ACK] Seq=268929 Ack=1 Win=29312 Len=1448 TSval=3166213287 TSecr=505575891
    397 81.801952132   192.168.0.18          192.168.0.3           TCP      1514   44928 → 1234 [ACK] Seq=270377 Ack=1 Win=29312 Len=1448 TSval=3166213287 TSecr=505575891
    398 81.802235289   192.168.0.18          192.168.0.3           TCP      1514   44928 → 1234 [ACK] Seq=271825 Ack=1 Win=29312 Len=1448 TSval=3166213287 TSecr=505575891
    399 81.802247314   192.168.0.18          192.168.0.3           TCP      1514   44928 → 1234 [ACK] Seq=273273 Ack=1 Win=29312 Len=1448 TSval=3166213287 TSecr=505575891
    400 81.802249140   192.168.0.18          192.168.0.3           TCP      1514   44928 → 1234 [ACK] Seq=274721 Ack=1 Win=29312 Len=1448 TSval=3166213288 TSecr=505575891
    401 81.802408981   192.168.0.18          192.168.0.3           TCP      1514   44928 → 1234 [ACK] Seq=276169 Ack=1 Win=29312 Len=1448 TSval=3166213288 TSecr=505575891
    402 81.802663773   192.168.0.18          192.168.0.3           TCP      1514   44928 → 1234 [ACK] Seq=277617 Ack=1 Win=29312 Len=1448 TSval=3166213288 TSecr=505575892
    403 81.802668013   192.168.0.18          192.168.0.3           TCP      1514   44928 → 1234 [ACK] Seq=279065 Ack=1 Win=29312 Len=1448 TSval=3166213288 TSecr=505575892
    404 81.802931015   192.168.0.3           192.168.0.18          TCP      66     1234 → 44928 [ACK] Seq=1 Ack=244313 Win=336128 Len=0 TSval=505576017 TSecr=3166213287
    405 81.802959919   192.168.0.3           192.168.0.18          TCP      66     1234 → 44928 [ACK] Seq=1 Ack=247209 Win=336128 Len=0 TSval=505576017 TSecr=3166213287
    406 81.802968239   192.168.0.3           192.168.0.18          TCP      66     1234 → 44928 [ACK] Seq=1 Ack=250105 Win=336128 Len=0 TSval=505576017 TSecr=3166213287
    407 81.802974660   192.168.0.3           192.168.0.18          TCP      66     1234 → 44928 [ACK] Seq=1 Ack=253001 Win=336128 Len=0 TSval=505576017 TSecr=3166213287
    408 81.802989053   192.168.0.18          192.168.0.3           TCP      1514   44928 → 1234 [ACK] Seq=280513 Ack=1 Win=29312 Len=1448 TSval=3166213288 TSecr=505575892
    409 81.802993598   192.168.0.18          192.168.0.3           TCP      1514   44928 → 1234 [ACK] Seq=281961 Ack=1 Win=29312 Len=1448 TSval=3166213288 TSecr=505575892
    410 81.803162444   192.168.0.18          192.168.0.3           TCP      1514   44928 → 1234 [ACK] Seq=283409 Ack=1 Win=29312 Len=1448 TSval=3166213288 TSecr=505575892
    411 81.803167143   192.168.0.18          192.168.0.3           TCP      1514   44928 → 1234 [ACK] Seq=284857 Ack=1 Win=29312 Len=1448 TSval=3166213288 TSecr=505575892
    412 81.803428152   192.168.0.18          192.168.0.3           TCP      1514   44928 → 1234 [ACK] Seq=286305 Ack=1 Win=29312 Len=1448 TSval=3166213288 TSecr=505575892
    413 81.803432161   192.168.0.18          192.168.0.3           TCP      1514   44928 → 1234 [ACK] Seq=287753 Ack=1 Win=29312 Len=1448 TSval=3166213288 TSecr=505575892
    414 81.803682074   192.168.0.18          192.168.0.3           TCP      1514   44928 → 1234 [ACK] Seq=289201 Ack=1 Win=29312 Len=1448 TSval=3166213288 TSecr=505575892
    415 81.803686120   192.168.0.18          192.168.0.3           TCP      1514   44928 → 1234 [ACK] Seq=290649 Ack=1 Win=29312 Len=1448 TSval=3166213288 TSecr=505575892
    416 81.803909293   192.168.0.3           192.168.0.18          TCP      66     1234 → 44928 [ACK] Seq=1 Ack=255897 Win=336128 Len=0 TSval=505576017 TSecr=3166213287
    417 81.803921121   192.168.0.3           192.168.0.18          TCP      66     1234 → 44928 [ACK] Seq=1 Ack=258793 Win=336128 Len=0 TSval=505576017 TSecr=3166213287
    418 81.803926850   192.168.0.3           192.168.0.18          TCP      66     1234 → 44928 [ACK] Seq=1 Ack=261689 Win=336128 Len=0 TSval=505576017 TSecr=3166213287
    419 81.803932297   192.168.0.3           192.168.0.18          TCP      66     1234 → 44928 [ACK] Seq=1 Ack=263137 Win=339072 Len=0 TSval=505576017 TSecr=3166213287
    420 81.803938976   192.168.0.3           192.168.0.18          TCP      66     1234 → 44928 [ACK] Seq=1 Ack=264585 Win=342016 Len=0 TSval=505576017 TSecr=3166213287
    421 81.803958653   192.168.0.18          192.168.0.3           TCP      1514   44928 → 1234 [ACK] Seq=292097 Ack=1 Win=29312 Len=1448 TSval=3166213288 TSecr=505575892
    422 81.803962010   192.168.0.18          192.168.0.3           TCP      1514   44928 → 1234 [ACK] Seq=293545 Ack=1 Win=29312 Len=1448 TSval=3166213288 TSecr=505575892
    423 81.804181671   192.168.0.18          192.168.0.3           TCP      1514   44928 → 1234 [ACK] Seq=294993 Ack=1 Win=29312 Len=1448 TSval=3166213288 TSecr=505575892
    424 81.804185952   192.168.0.18          192.168.0.3           TCP      1514   44928 → 1234 [ACK] Seq=296441 Ack=1 Win=29312 Len=1448 TSval=3166213288 TSecr=505575892
    425 81.804187627   192.168.0.18          192.168.0.3           TCP      1514   44928 → 1234 [ACK] Seq=297889 Ack=1 Win=29312 Len=1448 TSval=3166213288 TSecr=505575892
    426 81.804429507   192.168.0.18          192.168.0.3           TCP      730    44928 → 1234 [FIN, PSH, ACK] Seq=299337 Ack=1 Win=29312 Len=664 TSval=3166213288 TSecr=505575892
    427 81.804675922   192.168.0.3           192.168.0.18          TCP      66     1234 → 44928 [ACK] Seq=1 Ack=266033 Win=344832 Len=0 TSval=505576017 TSecr=3166213287
    428 81.804687814   192.168.0.3           192.168.0.18          TCP      66     1234 → 44928 [ACK] Seq=1 Ack=267481 Win=347776 Len=0 TSval=505576017 TSecr=3166213287
    429 81.804693770   192.168.0.3           192.168.0.18          TCP      66     1234 → 44928 [ACK] Seq=1 Ack=268929 Win=350720 Len=0 TSval=505576017 TSecr=3166213287
    430 81.804698903   192.168.0.3           192.168.0.18          TCP      66     1234 → 44928 [ACK] Seq=1 Ack=270377 Win=353536 Len=0 TSval=505576017 TSecr=3166213287
    431 81.804704173   192.168.0.3           192.168.0.18          TCP      66     1234 → 44928 [ACK] Seq=1 Ack=271825 Win=356480 Len=0 TSval=505576018 TSecr=3166213287
    432 81.804709176   192.168.0.3           192.168.0.18          TCP      66     1234 → 44928 [ACK] Seq=1 Ack=273273 Win=359296 Len=0 TSval=505576018 TSecr=3166213287
    433 81.805173546   192.168.0.3           192.168.0.18          TCP      66     1234 → 44928 [ACK] Seq=1 Ack=274721 Win=362240 Len=0 TSval=505576018 TSecr=3166213287
    434 81.805188104   192.168.0.3           192.168.0.18          TCP      66     1234 → 44928 [ACK] Seq=1 Ack=276169 Win=365184 Len=0 TSval=505576018 TSecr=3166213288
    435 81.805194036   192.168.0.3           192.168.0.18          TCP      66     1234 → 44928 [ACK] Seq=1 Ack=277617 Win=368000 Len=0 TSval=505576018 TSecr=3166213288
    436 81.805422954   192.168.0.3           192.168.0.18          TCP      66     1234 → 44928 [ACK] Seq=1 Ack=279065 Win=370944 Len=0 TSval=505576018 TSecr=3166213288
    437 81.805433354   192.168.0.3           192.168.0.18          TCP      66     1234 → 44928 [ACK] Seq=1 Ack=280513 Win=373888 Len=0 TSval=505576018 TSecr=3166213288
    438 81.805438999   192.168.0.3           192.168.0.18          TCP      66     1234 → 44928 [ACK] Seq=1 Ack=281961 Win=376704 Len=0 TSval=505576018 TSecr=3166213288
    439 81.806125158   192.168.0.3           192.168.0.18          TCP      66     1234 → 44928 [ACK] Seq=1 Ack=283409 Win=379648 Len=0 TSval=505576018 TSecr=3166213288
    440 81.806135471   192.168.0.3           192.168.0.18          TCP      66     1234 → 44928 [ACK] Seq=1 Ack=284857 Win=382464 Len=0 TSval=505576018 TSecr=3166213288
    441 81.806140828   192.168.0.3           192.168.0.18          TCP      66     1234 → 44928 [ACK] Seq=1 Ack=286305 Win=385408 Len=0 TSval=505576018 TSecr=3166213288
    442 81.806146564   192.168.0.3           192.168.0.18          TCP      66     1234 → 44928 [ACK] Seq=1 Ack=287753 Win=388352 Len=0 TSval=505576018 TSecr=3166213288
    443 81.806151416   192.168.0.3           192.168.0.18          TCP      66     1234 → 44928 [ACK] Seq=1 Ack=289201 Win=391168 Len=0 TSval=505576018 TSecr=3166213288
    444 81.806156884   192.168.0.3           192.168.0.18          TCP      66     1234 → 44928 [ACK] Seq=1 Ack=290649 Win=394112 Len=0 TSval=505576018 TSecr=3166213288
    445 81.806843330   192.168.0.3           192.168.0.18          TCP      66     1234 → 44928 [ACK] Seq=1 Ack=292097 Win=397056 Len=0 TSval=505576018 TSecr=3166213288
    446 81.806853707   192.168.0.3           192.168.0.18          TCP      66     1234 → 44928 [ACK] Seq=1 Ack=293545 Win=399872 Len=0 TSval=505576018 TSecr=3166213288
    447 81.806859057   192.168.0.3           192.168.0.18          TCP      66     1234 → 44928 [ACK] Seq=1 Ack=294993 Win=402816 Len=0 TSval=505576018 TSecr=3166213288
    448 81.806864334   192.168.0.3           192.168.0.18          TCP      66     1234 → 44928 [ACK] Seq=1 Ack=296441 Win=405632 Len=0 TSval=505576018 TSecr=3166213288
    449 81.806870518   192.168.0.3           192.168.0.18          TCP      66     1234 → 44928 [ACK] Seq=1 Ack=297889 Win=408576 Len=0 TSval=505576018 TSecr=3166213288
    450 81.806876139   192.168.0.3           192.168.0.18          TCP      66     1234 → 44928 [ACK] Seq=1 Ack=300002 Win=412800 Len=0 TSval=505576018 TSecr=3166213288
    451 81.808238842   192.168.0.3           192.168.0.18          TCP      66     1234 → 44928 [FIN, ACK] Seq=1 Ack=300002 Win=412800 Len=0 TSval=505576018 TSecr=3166213288
    452 82.308277071   192.168.0.18          192.168.0.3           TCP      66     44928 → 1234 [ACK] Seq=300002 Ack=2 Win=29312 Len=0 TSval=3166213414 TSecr=505576018
